name,brand,sold_by,old_price,current_price,saving,section,color,material
Workout Ready High Waist Leggings Black,Reebok,Namshi,205.0,144.0,61.0,Women,Black,Combination
Saudi Arabia Graphic T-Shirt Black/Metallic Gold,UNDER ARMOUR,noon,149.0,139.0,10.0,Men,Black/Metallic Gold,NA
Graphic T-Shirt Black,Reebok,noon,150.0,150.0,0.0,Men,Black,Polyester Blend
Must Haves Badge Of Sport Tshirt Blue,adidas,noon,115.0,74.0,41.0,Women,Blue,Polyester
Nsw Icon Futura Tank Top Black/Habanero Red,Nike,SIVVI,131.7,91.9,39.8,Men,Black/Habanero Red,Cotton
3-Stripe Short Sleeve Tshirt Collegiate Navy,adidas Originals,noon,139.0,118.0,21.0,Men,Collegiate Navy,Cotton
Workout Supremium 2.0 Graphic T-Shirt Medium Grey Heather,Reebok,noon,120.0,108.0,12.0,Men,Medium Grey Heather,NA
Kids Essential Plain T-Shirt Black,adidas,Namshi,75.0,75.0,0.0,Men,Black,Cotton
CrossFit Graphic T-shirt Black,Reebok,noon,130.0,124.0,6.0,Men,Black,Combination
Dri-FIT T-Shirt Game Royal,Nike,noon,149.0,119.0,30.0,Men,Game Royal,NA
Short Sleeve Sport Polo Green,adidas,noon,179.0,164.0,15.0,Men,Green,Combination
Jordan Jumpman Classic SweaT-Shirt Black,Nike,Namshi,329.0,329.0,0.0,Men,Black,80% Cotton 20% Polyester
Jordan Dri-FIT 23 Alpha Shorts Gym Red/White,Nike,noon,170.0,127.0,43.0,Men,Gym Red/White,Polyester
Leg-A-See Leggings Grey,Nike,noon,149.0,111.0,38.0,Women,Grey,Cotton Blend
Rc Burnout Ss T- Shirt Coal,Reebok,noon,252.0,236.0,16.0,Men,Coal,Polyester
ID Mesh T-Shirt Black,adidas,noon,169.0,109.0,60.0,Women,Black,Polyester Blend
Hero Racerback Padded Bra Cool Shadow S18-R,Reebok,noon,185.0,74.0,111.0,Women,Cool Shadow S18-R,NA
Graphic Today Counts T-Shirt Blue,Reebok,Namshi,95.0,95.0,0.0,Women,Blue,Cotton
Sports Wear Club T-Shirt White/Black,Nike,noon,129.0,96.0,33.0,Men,White/Black,NA
Fitness Gloves Black,Reebok,Namshi,65.0,65.0,0.0,Men,Black,Combination
SB Dry Fit Logo T-Shirt Black,Nike,noon,149.0,111.0,38.0,Men,Black,NA
Dri-Fit Elastika Vest Pink Quartz/Black/Black,Nike,noon,150.0,112.0,38.0,Women,Pink Quartz/Black/Black,NA
One Series Lux 2.0 Tights Black,Reebok,noon,255.0,153.0,102.0,Women,Black,Polyamide Blend
Team Issue Fleece Hoodie Grey,adidas,Namshi,250.0,95.0,155.0,Men,Grey,Polyester
Design2Move Climacool 3 Stripe Knit Short Black,adidas,noon,139.0,97.0,42.0,Men,Black,Polyester
Just Do It Swoosh T-Shirt White,Nike,Namshi,129.0,129.0,0.0,Men,White,Cotton
Dry Cool Miler T-shirt Black,Nike,noon,149.0,111.0,38.0,Men,Black,NA
Design 2 Move Logo Print Tshirt Black,adidas,noon,89.0,66.0,23.0,Men,Black,Polyester Blend
Classic Graphic T-shirt Black,Reebok,noon,140.0,134.0,6.0,Men,Black,Cotton
Real Madrid DNA Graphic Tshirt White,adidas,Namshi,135.0,135.0,0.0,Men,White,Cotton
Saudi Arabia Graphic T-Shirt White /Metallic Gold,UNDER ARMOUR,noon,149.0,139.0,10.0,Men,White /Metallic Gold,NA
Yoga Lux Bold High Rise Tights Blue,Reebok,noon,235.0,141.0,94.0,Women,Blue,Polyester Blend
Shmoo Graphic Tshirt Black,adidas,noon,155.0,155.0,0.0,Men,Black,Cotton
Dri-FIT T-Shirt Black,Nike,noon,149.0,119.0,30.0,Men,Black,NA
Trefoil Crew Neck Sweatshirt Black,adidas Originals,Namshi,275.0,275.0,0.0,Women,Black,Cotton
Dri-FIT All Over Print 4.0 Shorts Wheat/White,Nike,noon,170.0,127.0,43.0,Men,Wheat/White,Polyester
Toolkit 9 Skateboarding Tshirt White,adidas,noon,155.0,155.0,0.0,Men,White,Cotton
Classic Big Logo T-shirt White,Reebok,noon,140.0,91.0,49.0,Men,White,Cotton
Round Neck Short Sleeve T-Shirt Blue,adidas,Namshi,75.0,75.0,0.0,Kids Unisex,Blue,Cotton
FreeLift Sport Ultimate Heather T-Shirt Grey,adidas,noon,139.0,97.0,42.0,Men,Grey,NA
Classic Pad Bra Black,Nike,noon,185.0,148.0,37.0,Women,Black,Polyester Blend
Design 2 Move Logo Tshirt White/Black,adidas,noon,129.0,90.0,39.0,Women,White/Black,Polyester Blend
Air Running Jacket Sanded Purple/White,Nike,noon,329.0,246.0,83.0,Women,Sanded Purple/White,NA
Makes You Better Print Tshirt Harbor Blue,UNDER ARMOUR,noon,149.0,96.0,53.0,Men,Harbor Blue,NA
Rc Neon Retro Easy T- Shirt Urban Violet,Reebok,noon,105.0,99.0,6.0,Women,Urban Violet,Cotton
Must Have Sweatpants black,adidas,Namshi,210.0,210.0,0.0,Men,black,Combination
Nsw Swoosh T-Shirt Black,Nike,Namshi,149.0,149.0,0.0,Women,Black,Cotton
Arsenal FC Away Jersey Yellow,adidas,noon,409.0,265.0,144.0,Men,Yellow,Polyester Blend
Meet You There Panelled Leggings Blue,Reebok,noon,185.0,120.0,65.0,Women,Blue,Polyester
Mid Crossback Strappy Bra Level Purple / Black,UNDER ARMOUR,noon,169.0,118.0,51.0,Women,Level Purple / Black,Polyester
Collective Shorts Black,PUMA,Namshi,160.0,160.0,0.0,Men,Black,Polyester
Alpha Therma Fleece Hoodie Carbon Heather/Black,Nike,noon,329.0,263.0,66.0,Men,Carbon Heather/Black,NA
3 Stripe T-Shirt Tech Mineral,adidas Originals,noon,169.0,118.0,51.0,Women,Tech Mineral,NA
City Sleek Vest White,Nike,noon,199.0,139.0,60.0,Women,White,NA
Design 2 Move Tshirt Black/White,adidas,noon,129.0,96.0,33.0,Women,Black/White,NA
Rise Up N Run Parley Tshirt White,adidas,noon,195.0,126.0,69.0,Women,White,Polyester
Challenger Printed Shorts Grey,Nike,noon,169.0,109.0,60.0,Men,Grey,Polyester
Mesh Boxy Tshirt Black,adidas,noon,195.0,189.0,6.0,Women,Black,Combination
Must Have Badge Of Sport Logo Tshirt Medium Grey Heather/Black,adidas,noon,115.0,86.0,29.0,Men,Medium Grey Heather/Black,NA
Essentials 3-Stripes Leggings Blue,adidas,noon,155.0,79.95,75.05,Women,Blue,Cotton Blend
Classics T-Shirt White,Reebok,Namshi,140.0,140.0,0.0,Women,White,Cotton
Dri Fit Breathe Run T-Shirt Black/Barely Volt/White,Nike,noon,120.0,90.0,30.0,Men,Black/Barely Volt/White,NA
EvoKnit Short Sleeve T-Shirt Grey,PUMA,noon,240.0,235.0,5.0,Men,Grey,Nylon Blend
Bos Racerback Bra Pink,adidas,Namshi,125.0,125.0,0.0,Women,Pink,Polyester
Crossfit Games Crest T-Shirt Black,Reebok,noon,139.0,69.0,70.0,Men,Black,NA
Bts 3 Stripe Jacket Black,adidas,Namshi,475.0,475.0,0.0,Men,Black,Polyester
Camiseta Short Sleeves Graphic T-shirt Black,Reebok,noon,150.0,150.0,0.0,Men,Black,Polyester Blend
Design 2 Move 3 Stripe Tshirt Active Blue,adidas,noon,130.0,125.0,5.0,Men,Active Blue,Polyester Blend
Air Long Sleeve T-Shirt Luminous Green,Nike,noon,169.0,166.0,3.0,Women,Luminous Green,Cotton
Design 2 Move 3 Stripes Tshirt Blue,adidas,noon,129.0,90.0,39.0,Men,Blue,Polyester Blend
Rebel All In 7/8 Sweatpants Multicolour,Nike,noon,255.0,204.0,51.0,Women,Multicolour,Polyester
Must Have 3 Stripe Crew Sweatshirt Black,adidas,Namshi,249.0,249.0,0.0,Men,Black,Polyester
3-Stripe Track Pants Black,adidas,Namshi,209.0,209.0,0.0,Women,Black,Polyester
Rally Metallic Sweatpants Black,Nike,noon,299.0,209.0,90.0,Women,Black,Cotton Blend
Logo Printed Tank Top Light Blue,adidas,noon,140.0,140.0,0.0,Women,Light Blue,NA
Lightweight Training Socks 3 Pc Black/White,Nike,noon,70.0,56.0,14.0,Women,Black/White,Combination
VRCT Hoodie black,adidas,Namshi,375.0,375.0,0.0,Men,black,Cotton Blend
Meet You There Sweatshirt Multicolour,Reebok,Namshi,255.0,255.0,0.0,Men,Multicolour,Polyester
Camouflage Mix Tshirt Black,adidas Originals,noon,139.0,97.0,42.0,Men,Black,Cotton
Trefoil Leggings Blue,adidas Originals,noon,169.0,126.0,43.0,Women,Blue,Cotton Blend
Own the Run Shorts Black,adidas,noon,169.0,118.0,51.0,Men,Black,Polyester Blend
Trefoil Logo Print Tshirt White,adidas,noon,155.0,108.0,47.0,Men,White,Cotton
Floral Allover Print Leggings Multicolour,adidas Originals,noon,169.0,101.0,68.0,Women,Multicolour,Polyester Blend
Training Esssentials Twill Hoodie Black,Reebok,Namshi,255.0,255.0,0.0,Men,Black,Cotton
Workout Climacool Sweatpants Blue,adidas,noon,305.0,183.0,122.0,Men,Blue,Polyester
Kids Tricot Tracksuit Black/White,Nike,noon,249.0,199.0,50.0,Girls,Black/White,Polyester
Design 2 Move Climalite Tshirt Black,adidas,noon,115.0,74.0,41.0,Men,Black,Polyester
Solid Design Alumni Shorts Teal,Nike,Namshi,269.0,269.0,0.0,Men,Teal,Polyester
CrossFit Speedwick Graphic T-Shirt Urban Violet,Reebok,noon,130.0,117.0,13.0,Men,Urban Violet,NA
Dri-FIT Hoodie Grey,Nike,Namshi,399.0,399.0,0.0,Men,Grey,88% Polyester 12% Elastane
Modern Muscle Vest Pistachio Frost/Black,Nike,noon,129.0,90.0,39.0,Women,Pistachio Frost/Black,NA
3-Stripe Sweatpants Navy,adidas,Namshi,299.0,299.0,0.0,Men,Navy,Polyester
Versatile Climalite Gloves Black,adidas,Namshi,125.0,125.0,0.0,Men,Black,Polyester
Supernova Climalite Vest Black,adidas,Namshi,205.0,113.0,92.0,Women,Black,Combination
Camo 3/4 Tights Olive Canvas,Nike,noon,203.0,131.0,72.0,Men,Olive Canvas,Combination
Just Do It Fleece Pants Black/White,Nike,noon,335.0,268.0,67.0,Men,Black/White,Cotton Blend
Badge Of Sport Logo Print Tshirt White,adidas,noon,179.0,125.0,54.0,Women,White,NA
Tech 2.0 Hoodie Black,UNDER ARMOUR,Namshi,189.0,189.0,0.0,Men,Black,Polyester
Pro Hijab Black,Nike,Namshi,105.0,65.0,40.0,Women,Black,Combination
S2S Sweatpants Grey,adidas,Namshi,239.0,239.0,0.0,Women,Grey,Fabric
Trefoil T-Shirt Navy,adidas Originals,Namshi,135.0,95.0,40.0,Men,Navy,Cotton
Design2Move Climacool Logo Tee White,adidas,noon,115.0,80.0,35.0,Men,White,Polyester Blend
4Krft Sport Shorts Blue,adidas,Namshi,165.0,165.0,0.0,Men,Blue,Polyester
Freedom Graphic Tee White/Black,Reebok,noon,145.0,87.0,58.0,Men,White/Black,NA
Classic Vector T-Shirt Black,Reebok,noon,165.0,165.0,0.0,Men,Black,Cotton
Otr Bra Hero Yellow,Reebok,noon,165.0,74.0,91.0,Women,Hero Yellow,NA
Prime Basic Tshirt Legend Ivy,adidas,noon,115.0,80.0,35.0,Women,Legend Ivy,Combination
SB Classic Trefoil Cap Black,adidas Originals,Namshi,115.0,115.0,0.0,Men,Black,Cotton
Essentials 3-Stripes Pants Grey,adidas,noon,215.0,150.0,65.0,Women,Grey,Cotton Blend
Alphaskin Badge Of Sport Logo Printed Leggings Grey,adidas,Namshi,209.0,209.0,0.0,Women,Grey,Polyester
Must Haves Logo Print Tshirt Black,adidas,Namshi,115.0,115.0,0.0,Men,Black,Cotton
Favorite Cropped Sweatshirt white,UNDER ARMOUR,Namshi,169.0,169.0,0.0,Women,white,Polyester
Allover Print Tights Tech Mineral/Black,adidas Originals,noon,169.0,118.0,51.0,Women,Tech Mineral/Black,Cotton Blend
Matchup Pique Polo White,Nike,Namshi,169.0,169.0,0.0,Men,White,Cotton
MK1 Terry Funnel Neck Sweatshirt grey,UNDER ARMOUR,Namshi,315.0,221.0,94.0,Men,grey,Polyester
Essential Linear Sweatpants Black,adidas,Namshi,200.0,199.0,1.0,Men,Black,Combination
Essentials Vest Guava Ice/White,Nike,noon,152.0,91.0,61.0,Women,Guava Ice/White,NA
Te Elet- T- Shirt Lavender Luck F14-R,Reebok,noon,105.0,96.0,9.0,Women,Lavender Luck F14-R,Cotton
Breathe Run Vest Black/Reflective Silv,Nike,noon,89.0,75.0,14.0,Men,Black/Reflective Silv,NA
Jordan Sport DNA Fleece Hoodie Grey,Nike,Namshi,399.0,399.0,0.0,Men,Grey,80% Cotton 20% Polyester
adicolor Trefoil T-Shirt Blue,adidas Originals,Namshi,135.0,135.0,0.0,Women,Blue,Combination
Design 2 Move Cropped Tshirt Semi Coral/White,adidas,noon,115.0,80.0,35.0,Women,Semi Coral/White,NA
Mono Square Logo Tshirt Collegiate Green,adidas Originals,noon,169.0,126.0,43.0,Men,Collegiate Green,Cotton
Commercial Bomber Jacket Grey,adidas,Namshi,249.0,249.0,0.0,Men,Grey,Polyester
Jumpman Sweatpants Green,Nike,Namshi,369.0,369.0,0.0,Men,Green,Polyester
Must Have Badge Of Sport Short Black/White,adidas,noon,195.0,146.0,49.0,Men,Black/White,Cotton Blend
Workout Ready Graphic T-Shirt Green,Reebok,Namshi,120.0,120.0,0.0,Women,Green,Polyester
Dry 4.0 Big Logo Shorts Black/White,Nike,noon,150.0,127.0,23.0,Men,Black/White,Polyester
Essentials 3 Stripe Leggings Navy,adidas,Namshi,149.0,104.0,45.0,Women,Navy,Cotton
Essentials Plain T-shirt Legend Ink/White,adidas,noon,99.0,69.0,30.0,Men,Legend Ink/White,Cotton
Breathe Pro Training T-Shirt Grey,Nike,noon,219.0,175.0,44.0,Men,Grey,NA
Ac F Ss Longer T- Shirt White,Reebok,noon,173.0,159.0,14.0,Men,White,Cotton
Hyper Dry T-shirt Grey/Black,Nike,noon,169.0,109.0,60.0,Men,Grey/Black,NA
Adicolor Trefoil Tshirt White,adidas Originals,Namshi,135.0,135.0,0.0,Men,White,Cotton
Cully Graphic Jersey Tshirt Trace Purple/Blue/Easy Yellow/Clear Mint,adidas,noon,155.0,149.0,6.0,Men,Trace Purple/Blue/Easy Yellow/Clear Mint,NA
Mesh Statement Shorts White,Nike,Namshi,269.0,188.0,81.0,Men,White,Polyester
7/8 Air Mesh Running Leggings Pink,Nike,noon,269.0,188.0,81.0,Women,Pink,Nylon Blend
SSG Game Day Shorts Black,umbro,noon,152.0,38.0,114.0,Men,Black,Polyester
Must Haves 3 Stripe Tshirt White,adidas,Namshi,135.0,135.0,0.0,Men,White,Cotton
Wor Activchill Graph Ss T- Shirt Crushed Cobalt,Reebok,noon,158.0,149.0,9.0,Men,Crushed Cobalt,Polyamide
Alphaskin Moto Leggings Black,adidas,noon,245.0,147.0,98.0,Women,Black,Polyester Blend
Miler Tech Vest Signal Blue,Nike,noon,132.0,85.0,47.0,Men,Signal Blue,Polyester
Modern Graphic T-Shirt White,PUMA,Namshi,115.0,115.0,0.0,Women,White,Cotton
Short Sleeve Solid Tshirt Grey,adidas,noon,115.0,80.0,35.0,Men,Grey,Polyester
Mesh Statement Vest White,Nike,Namshi,199.0,199.0,0.0,Men,White,Polyester
Essential Logo Sweatpants Grey,PUMA,Namshi,185.0,185.0,0.0,Men,Grey,Combination
New Hustle Graphic Tshirt Blue,adidas,noon,115.0,107.0,8.0,Men,Blue,Cotton Blend
Classic T-Shirt Black/White,VANS,SIVVI,106.15,106.15,0.0,Men,Black/White,Cotton
Adicolor 3 Stripe Tshirt White/Black,adidas Originals,Namshi,135.0,135.0,0.0,Men,White/Black,Cotton
Essential Pants Beige,Reebok,Namshi,235.0,235.0,0.0,Women,Beige,Polyester
Freelift Climalite Tshirt Active Orange,adidas,noon,245.0,159.0,86.0,Men,Active Orange,Polyester
Te Polot-Shirt Chalk Green S18-R,Reebok,noon,184.0,169.0,15.0,Men,Chalk Green S18-R,Cotton
Kids Sesame Street Graphic T-Shirt Black,PUMA,Namshi,95.0,95.0,0.0,Boys,Black,Cotton
Indy Air Graphic Sports Bra Echo Pink/Black,Nike,noon,195.0,136.0,59.0,Women,Echo Pink/Black,NA
Casual Activchill Vest Twisted Berry,Reebok,noon,155.0,77.0,78.0,Women,Twisted Berry,NA
Nsw Jdi Fleece Bstr Joggers Charcoal Heathr,Nike,SIVVI,305.3,213.4,91.9,Women,Charcoal Heathr,Cotton Blend
Design 2 Move High Rise Leggings Black/Grey,adidas,noon,215.0,150.0,65.0,Women,Black/Grey,Polyester Blend
Round Neck Short Sleeve T-Shirt Navy,adidas,Namshi,125.0,125.0,0.0,Men,Navy,Cotton
ID Spray Dye Logo Print Tshirt Blue,adidas,noon,195.0,189.0,6.0,Men,Blue,Polyester
Workout Ready Muscle Vest White,Reebok,noon,100.0,100.0,0.0,Women,White,Cotton Blend
Logo Fitness Gloves Multicolour,Reebok,Namshi,65.0,65.0,0.0,Women,Multicolour,Cotton
Trefoil French Terry Hoodie Black,adidas Originals,Namshi,325.0,325.0,0.0,Men,Black,Cotton
Real Madrid Away Jersey Blue,adidas,Namshi,400.0,280.0,120.0,Men,Blue,Combination
Must Have Badge Of Sport Logo Tshirt Black,adidas,noon,115.0,74.0,41.0,Men,Black,NA
Graphic Short Sleeves T-Shirt Light Grey Heather,Reebok,noon,150.0,131.0,19.0,Men,Light Grey Heather,NA
Skateboarding Icon Fleece Essential Sweatpants Dk Grey Heather/Black,Nike,noon,305.0,244.0,61.0,Men,Dk Grey Heather/Black,Cotton Blend
Good Grief Pocket Tshirt White,VANS,noon,135.0,132.0,3.0,Men,White,Cotton
Short Sleeve Solid Tshirt Green,adidas,noon,100.0,65.0,35.0,Men,Green,Cotton
And Melange Colourblock T-Shirt Black-Athletic Heather,VANS,SIVVI,86.75,86.75,0.0,Men,Black-Athletic Heather,Cotton Blend
Kids Inside Socks Pack Of 3 Black,Reebok,Namshi,30.0,30.0,0.0,Boys,Black,Combination
Trefoil Tshirt Yellow,adidas Originals,Namshi,135.0,135.0,0.0,Women,Yellow,Combination
10K Breathe T-Shirt Black,Nike,noon,169.0,118.0,51.0,Women,Black,NA
Classics Disruptive T-Shirt White,Reebok,noon,165.0,149.0,16.0,Men,White,NA
Ufc Fg Logo T- Shirt Medium Grey Heather,Reebok,noon,137.0,129.0,8.0,Men,Medium Grey Heather,Cotton
Classic Vector T-shirt Blue,Reebok,noon,165.0,161.0,4.0,Men,Blue,Cotton
Big Logo Print T-Shirt White,Nike,noon,149.0,146.0,3.0,Women,White,Cotton
Los Angeles Lakers Club Fleece Hoodie purple,Nike,Namshi,329.0,329.0,0.0,Men,purple,Fabric
3-Stripe Short Sleeve Tshirt Collegiate Green,adidas Originals,noon,139.0,104.0,35.0,Men,Collegiate Green,Cotton
Less Mills Bodypump Vest Dark Grey Heather,Reebok,noon,185.0,111.0,74.0,Women,Dark Grey Heather,Polyester
All Me 3 Stripe Bra Real Pink,adidas,noon,155.0,108.0,47.0,Women,Real Pink,NA
Kids French Terry Shorts Dark Grey Heather/White,Nike,noon,149.0,111.0,38.0,Boys,Dark Grey Heather/White,Cotton
Paris Saint Germain Home T-Shirt Midnight Navy/White/Red,Nike,noon,407.0,244.0,163.0,Men,Midnight Navy/White/Red,Polyester
Futura Vest Rust Pink,Nike,noon,125.0,82.0,43.0,Women,Rust Pink,Combination
Must Have Badge Of Sport Vest White/Black,adidas,noon,115.0,80.0,35.0,Men,White/Black,Cotton
Juventus Anthem Jacket Black,adidas,Namshi,399.0,279.0,120.0,Men,Black,Polyester
All In AOP Leggings White/Grey,Nike,noon,205.0,143.0,62.0,Women,White/Grey,Polyester Blend
Essentials 3 Stripe Tshirt,adidas,noon,140.0,137.0,3.0,Men,NA,Cotton
Sport 2 Street Tshirt Black Melange,adidas,noon,195.0,189.0,6.0,Women,Black Melange,Cotton Blend
Pro Running Leggings Black/Particle Grey/Black,Nike,noon,205.0,143.0,62.0,Men,Black/Particle Grey/Black,Polyester
Essentials Linear Tshirt Pink,adidas,Namshi,75.0,75.0,0.0,Women,Pink,Cotton
Varsity Block Vest Echo Pink,Nike,noon,129.0,90.0,39.0,Women,Echo Pink,Cotton
Icon Futura T-Shirt Black/Hyper Jade,Nike,noon,130.0,123.0,7.0,Men,Black/Hyper Jade,NA
Kids Dri-Fit Neymar Shorts Black/Laser Crimson/White,Nike,noon,149.0,111.0,38.0,Boys,Black/Laser Crimson/White,Polyester
Air Short Sleeve T-Shirt Blue Force/Oxygen Purple,Nike,noon,129.0,83.0,46.0,Women,Blue Force/Oxygen Purple,Modal
FreeLift Gradient Training Tshirt Blue,adidas,noon,180.0,117.0,63.0,Men,Blue,NA
Swyft Short Sleeves Tshirt Blue,UNDER ARMOUR,noon,170.0,166.0,4.0,Women,Blue,"50% Polyester,50% Elasterell P"
Kids Have A Nike Day Crop Top Black,Nike,Namshi,89.0,89.0,0.0,Girls,Black,Polyester
Tango Logo T-Shirt White,adidas,Namshi,189.0,189.0,0.0,Men,White,Cotton
Nsw Essential Aop Leggings Monochrome,Nike,Namshi,199.0,199.0,0.0,Women,Monochrome,Polyester
Dri-Fit Miler T-Shirt Blue,Nike,noon,149.0,111.0,38.0,Men,Blue,Polyester
Alphaskin Tech Short Tights Black,adidas,noon,215.0,118.0,97.0,Women,Black,Combination
Classic Taped T-Shirt Black,Reebok,noon,165.0,149.0,16.0,Men,Black,NA
Infants T-Shirt And Shorts Set 2 Pc Orange/Grey,Nike,Namshi,129.0,129.0,0.0,Baby Unisex,Orange/Grey,Polyester
ID Mesh Tank Mystery Ink F17,adidas,noon,170.0,93.0,77.0,Women,Mystery Ink F17,NA
Speedwick Graphic T-Shirt Chalk Green,Reebok,noon,150.0,135.0,15.0,Men,Chalk Green,NA
Rebel Swoosh Just Do It Sports Bra Jade Horizon/Black,Nike,noon,189.0,132.0,57.0,Women,Jade Horizon/Black,NA
D2M 3 Stripes T-Shirt White,adidas,noon,139.0,97.0,42.0,Men,White,NA
Kids Training Graphic Tshirt White/Real Pink,adidas,noon,99.0,69.0,30.0,Girls,White/Real Pink,Cotton Blend
Indy Logo Sports Bra Black/Black/Cool Grey,Nike,noon,205.0,143.0,62.0,Women,Black/Black/Cool Grey,Polyester Blend
Workout Ready Strappy Bra Beige,Reebok,Namshi,100.0,100.0,0.0,Women,Beige,Polyester
Elements Vest White,Reebok,noon,185.0,162.0,23.0,Women,White,NA
Infants Summer Set Multicolour,adidas,Namshi,149.0,149.0,0.0,Men,Multicolour,Cotton
Tango Logo T-Shirt White,adidas,Namshi,189.0,189.0,0.0,Men,White,Cotton
Infant Summer Set Pink/Navy,adidas,Namshi,149.0,149.0,0.0,Baby Girls,Pink/Navy,Cotton
Logo Printed Sweatpants Black,adidas,Namshi,325.0,325.0,0.0,Women,Black,Nylon
Must Haves Plain Tshirt Black,adidas,noon,115.0,74.0,41.0,Men,Black,Cotton
Just Do It Vest White,Nike,noon,129.0,96.0,33.0,Men,White,NA
Just Do It All In Leggings Black/White,Nike,noon,205.0,164.0,41.0,Women,Black/White,NA
Essential T-Shirt White,adidas,Namshi,99.0,99.0,0.0,Men,White,Cotton
Dri-Fit Tapered Fleece Camo Sweatpants Grey,Nike,noon,229.0,183.0,46.0,Men,Grey,Polyester
Short Sleeve Vintage T-Shirt Black/Blubir,adidas Originals,SIVVI,137.85,97.0,40.85,Men,Black/Blubir,Combination
Athletics Pack Tshirt White,adidas,Namshi,149.0,104.0,45.0,Men,White,Cotton
Club Jersey Sweatpants Grey,Nike,Namshi,169.0,169.0,0.0,Men,Grey,Cotton
Concept Core 1 T-Shirt Indigo Storm/Black,Nike,noon,169.0,166.0,3.0,Women,Indigo Storm/Black,Polyester
Classics T-Shirt Green,Reebok,Namshi,165.0,165.0,0.0,Men,Green,Cotton
Dri Fit Miler T-Shirt Blue,Nike,noon,169.0,126.0,43.0,Men,Blue,NA
Cl Reebok Cl Graphic T- Shirt Urban Violet,Reebok,noon,147.0,138.0,9.0,Men,Urban Violet,Cotton
Accelerate Textured Mid Rise Leggings Black/Green,New Balance,noon,229.0,80.0,149.0,Women,Black/Green,Polyester Blend
CLUB Sleevless Tank Top Pink/Blue/Black,adidas,noon,170.0,93.0,77.0,Women,Pink/Blue/Black,NA
Essentials Linear Logo Tshirt Blue,adidas,noon,99.0,74.0,25.0,Men,Blue,Cotton
NSW T-Shirt White,Nike,noon,129.0,109.0,20.0,Men,White,Cotton
3 Stripe Snapback Black,adidas,Namshi,79.0,79.0,0.0,Men,Black,Cotton
Street Motorsport T-Shirt Puma Black,PUMA,noon,235.0,105.0,130.0,Men,Puma Black,Cotton
3-Stripes Aplhaskin Sport Long Tights Black,adidas,noon,255.0,165.0,90.0,Men,Black,Polyester Blend
Challenger Running Shorts Gunsmoke / Gunsmoke / Htr / Reflective Silver,Nike,noon,150.0,120.0,30.0,Men,Gunsmoke / Gunsmoke / Htr / Reflective Silver,Polyester
Power Gym Tights Grey/Black,Nike,noon,254.0,165.0,89.0,Women,Grey/Black,Combination
Tko Shorts Black,adidas,Namshi,240.0,144.0,96.0,Men,Black,Combination
Classic Graphic T-shirt Grey,Reebok,noon,130.0,117.0,13.0,Boys,Grey,Cotton
Striped Leggings Grey,adidas Originals,Namshi,135.0,135.0,0.0,Women,Grey,Polyester
Kids Logo Graphic Sweatshirt pink,adidas,Namshi,175.0,175.0,0.0,Kids Unisex,pink,Cotton
Trefoil Crew Neck Sweatshirt Green,adidas Originals,Namshi,275.0,275.0,0.0,Women,Green,Cotton
Tango Logo Print Tshirt Black,adidas,noon,139.0,104.0,35.0,Men,Black,Polyester Blend
3 Stripe Track Jacket Pink,adidas Originals,Namshi,325.0,325.0,0.0,Women,Pink,Combination
One Series Running Activchill T-Shirt Black,Reebok,noon,205.0,205.0,0.0,Men,Black,Polyamide
Dri-FIT Training Vest Grey,Nike,noon,150.0,105.0,45.0,Women,Grey,Polyester
Essentials Linear Tapered Stanford Sweatpants Legend Ink,adidas,noon,215.0,150.0,65.0,Men,Legend Ink,Polyester Blend
Juventus Training Jersey Black,adidas,Namshi,225.0,225.0,0.0,Men,Black,Polyester
FreeLift Sports T-Shirt White,adidas,noon,139.0,97.0,42.0,Men,White,NA
Global Logo T-Shirt Black/White,UNDER ARMOUR,noon,149.0,104.0,45.0,Men,Black/White,Cotton Blend
El Marble Group T-Shirt Skull Grey,Reebok,noon,120.0,108.0,12.0,Men,Skull Grey,NA
Combat Spray Dye T-Shirt Bunker Blue,Reebok,noon,185.0,167.0,18.0,Men,Bunker Blue,NA
Vector T-Shirt White/Vital Blue,Reebok,noon,195.0,176.0,19.0,Boys,White/Vital Blue,NA
Nsw Sport Charm T-Shirt Pink,Nike,Namshi,149.0,149.0,0.0,Women,Pink,Cotton
Classics Sweatpants Black,Reebok,Namshi,290.0,290.0,0.0,Men,Black,Polyester
Workout Ready Fleece Sweatpants Black,Reebok,Namshi,185.0,185.0,0.0,Men,Black,Polyester
Rebel Sleeveless Training Top Bright Crimson/White,Nike,noon,169.0,135.0,34.0,Women,Bright Crimson/White,Polyester Blend
Club Shorts Grey,Nike,noon,150.0,120.0,30.0,Men,Grey,Combination
MH Pocket T-Shirt Grey,adidas,noon,119.0,77.0,42.0,Men,Grey,Cotton
Ss Reflective T- Shirt White,Reebok,noon,215.0,201.0,14.0,Women,White,Polyester
Manchester United Full Sleeve Jacket Red,adidas,Namshi,399.0,399.0,0.0,Men,Red,Polyester
Graphic Wom  T- Shirt White,Reebok,noon,173.0,159.0,14.0,Women,White,Cotton
Must Haves Badge Of Sport Logo Print Tshirt White,adidas,noon,129.0,129.0,0.0,Men,White,Cotton
Running Activchill Tshirt White,Reebok,noon,210.0,105.0,105.0,Men,White,NA
Round Neck Logo Printed T-Shirt White,adidas,Namshi,79.0,79.0,0.0,Men,White,Cotton
HeatGear Capri Orange,UNDER ARMOUR,noon,150.0,75.0,75.0,Girls,Orange,Polyester
Indy Logo Sports Bra Black,Nike,Namshi,199.0,199.0,0.0,Women,Black,Combination
Striped Sweatpants Navy,adidas Originals,Namshi,325.0,325.0,0.0,Men,Navy,Polyester
Gradient Sleeveless Vest Grey,adidas,noon,155.0,85.0,70.0,Men,Grey,NA
Design 4 Training Tshirt Black,adidas,Namshi,165.0,165.0,0.0,Men,Black,Polyester
Nsw Essential T-Shirt Black,Nike,Namshi,129.0,129.0,0.0,Women,Black,Cotton
Must Haves Badge Of Sport Logo Print Tshirt White/Black,adidas,noon,115.0,86.0,29.0,Men,White/Black,Cotton
Saturday Shorts Blue,adidas,Namshi,225.0,135.0,90.0,Women,Blue,Combination
Training T-Shirt Outdoor Green/Htr/Black,Nike,noon,149.0,146.0,3.0,Women,Outdoor Green/Htr/Black,Cotton
Cardio Lux Bold Leggings Black,Reebok,noon,274.0,164.0,110.0,Women,Black,Combination
Graphic Printed T-Shirt Black/White,Reebok,noon,140.0,126.0,14.0,Men,Black/White,NA
Tailwind Run Division Tank Black,Nike,Namshi,269.0,161.0,108.0,Women,Black,Combination
Elements Marble Group Shorts Grey,Reebok,noon,155.0,93.0,62.0,Men,Grey,Cotton
Jordan Jumpman Fleece Sweatpants Grey,Nike,Namshi,369.0,369.0,0.0,Men,Grey,Polyester
FreeLift Engineered Heather T-Shirt Tech Olive,adidas,noon,169.0,118.0,51.0,Men,Tech Olive,NA
Nemeziz Graphic Back Print Tshirt White,adidas,noon,115.0,74.0,41.0,Men,White,Cotton
Must Have Sweatpants Grey,adidas,Namshi,239.0,239.0,0.0,Women,Grey,Cotton
Just Do It Hooded Jacket Black,Nike,SIVVI,335.9,234.85,101.05,Men,Black,Cotton Blend
Sportswear T-Shirt White,Nike,noon,119.0,95.0,24.0,Boys,White,NA
Youth Must Have Badge Of Sport Hoodie grey,adidas,Namshi,199.0,199.0,0.0,Men,grey,Fabric
Dri-Fit Printed T-shirt Black/White,Nike,noon,199.0,139.0,60.0,Men,Black/White,NA
Meet You There Jacket Black,Reebok,Namshi,255.0,255.0,0.0,Men,Black,Nylon
Jordan Jumpman T-Shirt Pink,Nike,Namshi,149.0,149.0,0.0,Men,Pink,Cotton
Allover Print Tights Maroon/Black,adidas Originals,noon,169.0,118.0,51.0,Women,Maroon/Black,Cotton Blend
3 Stripe Sweatpants Grey,adidas Originals,noon,329.0,174.4,154.6,Men,Grey,Cotton
Short Sleeve Sport Tshirt Dust Pink/White,adidas Originals,noon,170.0,164.0,6.0,Women,Dust Pink/White,Polyester
Dri-FIT Oversized Graphic T-Shirt Pink Quartz/Echo Pink,Nike,noon,129.0,103.0,26.0,Women,Pink Quartz/Echo Pink,Polyester Blend
Freelift Sport T-Shirt Black,adidas,Namshi,135.0,135.0,0.0,Men,Black,Polyester
Classics Vector Hoodie Grey,Reebok,noon,354.0,212.0,142.0,Men,Grey,Combination
NSW Fleece Plaid Sweatshirt Yellow/Black,Nike,Namshi,329.0,329.0,0.0,Women,Yellow/Black,Fabric
Sport ID Foil Print Tshirt Legend Earth,adidas,noon,155.0,108.0,47.0,Men,Legend Earth,NA
Los Angeles Lakers Spotlight Hoodie black,Nike,Namshi,369.0,369.0,0.0,Men,black,Fabric
Trefoil T-Shirt Red,adidas Originals,Namshi,135.0,135.0,0.0,Women,Red,Cotton
