name,brand,sold_by,old_price,current_price,saving,section,color,material
Essential 3 Stripe Hoodie Black,adidas,Namshi,249.0,249.0,0.0,Men,Black,Polyester
All Me Badge Of Sport Bra Black,adidas,noon,129.0,90.0,39.0,Women,Black,Polyester Blend
ACE Varsity Shorts Puma Black,PUMA,noon,210.0,84.0,126.0,Women,Puma Black,Polyester
Z.N.E Fast Release Mesh Hoodie Black,adidas,Namshi,375.0,375.0,0.0,Women,Black,Nylon
Ss Ac T- Shirt Blue Slate,Reebok,noon,215.0,201.0,14.0,Men,Blue Slate,Polyamide
Logo Issued T-Shirt Grey/Wire/Beta Red,UNDER ARMOUR,noon,149.0,104.0,45.0,Men,Grey/Wire/Beta Red,Cotton Blend
Yusuke Van Print Tshirt White,VANS,noon,119.0,117.0,2.0,Men,White,Cotton
All Over Mesh T-Shirt Gunsmoke/Black/Gunsmoke,Nike,noon,199.0,195.0,4.0,Men,Gunsmoke/Black/Gunsmoke,Polyester
Air Jacket Black/White,Nike,noon,329.0,246.0,83.0,Women,Black/White,NA
Activchill Jersey Skirt Collegiate Navy/White,Reebok,noon,170.0,85.0,85.0,Women,Collegiate Navy/White,Cotton French Terry
adicolor Superstar Sweatpants Black,adidas Originals,Namshi,275.0,275.0,0.0,Women,Black,Combination
Must Have Adjustable Drawstrings Hoodie Black,adidas,Namshi,275.0,275.0,0.0,Men,Black,Combination
VRCT Sweatshirt Black,adidas,Namshi,275.0,275.0,0.0,Men,Black,Polyester
Yoga Long Sleeve Cardigan Grey,Nike,noon,305.0,213.0,92.0,Women,Grey,Polyester Blend
Air Challenger 7in Shorts Grey,Nike,noon,152.0,91.0,61.0,Men,Grey,Polyester
Running ACTIVCHILL T-Shirt Mineral Mist,Reebok,noon,205.0,185.0,20.0,Women,Mineral Mist,NA
Jordan Jumpman Fleece Sweatpants Black,Nike,Namshi,369.0,369.0,0.0,Men,Black,Polyester
Jordan Shimmer Shorts Red/Black,Nike,noon,170.0,119.0,51.0,Men,Red/Black,Polyester
Believe This High Rise Elevated Leggings Blue,adidas,Namshi,350.0,228.0,122.0,Women,Blue,Combination
Breathe Chelsea FC Strike T-Shirt Anthracite/Black/Rush Orange,Nike,noon,199.0,159.0,40.0,Kids Unisex,Anthracite/Black/Rush Orange,NA
Pro Leggings Grey,Nike,Namshi,179.0,179.0,0.0,Men,Grey,Combination
Classics Disruptive T-Shirt Collegiate Navy,Reebok,noon,165.0,149.0,16.0,Men,Collegiate Navy,NA
Breathe Run Tank Black,Nike,Namshi,89.0,89.0,0.0,Men,Black,Polyester
Breathe Chelsea FC Strike T-Shirt Obsidian/Rush Blue,Nike,noon,199.0,159.0,40.0,Kids Unisex,Obsidian/Rush Blue,NA
SB Dry Fit Logo T-Shirt Obsidian,Nike,noon,149.0,111.0,38.0,Men,Obsidian,NA
D2M 3 Stripe T-Shirt Blue,adidas,Namshi,135.0,135.0,0.0,Men,Blue,Fabric
Kids Sportswear Club Fleece Pants Black,Nike,noon,249.0,186.0,63.0,Boys,Black,Cotton Blend
Dry-Fit Academy T-Shirt Navy,Nike,Namshi,109.0,109.0,0.0,Men,Navy,Polyester
Otw T-Shirt Black/White,VANS,SIVVI,106.15,106.15,0.0,Men,Black/White,Cotton
Believe This Moto 7/8 Leggings Blue,adidas,noon,355.0,213.0,142.0,Women,Blue,Polyester Blend
Sport ID Hoodie Grey,adidas,Namshi,299.0,299.0,0.0,Men,Grey,Polyester
Air Shorts Grey/Black/White,Nike,SIVVI,335.0,234.85,100.15,Men,Grey/Black/White,Combination
Swoosh Futura Sports Bra Black,Nike,noon,163.0,130.0,33.0,Women,Black,Combination
Kids Dri-Fit Paris Saint German Strike Tracksuit Oil Grey/Oil Grey/University Red,Nike,noon,499.0,374.0,125.0,Unisex,Oil Grey/Oil Grey/University Red,NA
Logo Sweatpants Navy,PUMA,Namshi,185.0,185.0,0.0,Men,Navy,Polyester
Essentials Linear Tapered Pants Black,adidas,noon,205.0,143.0,62.0,Men,Black,Cotton Blend
Team Signature Trefoil Tshirt Blue,adidas Originals,noon,169.0,118.0,51.0,Men,Blue,Cotton
Superstar Track Jacket Blue,adidas Originals,Namshi,375.0,263.0,112.0,Men,Blue,Combination
EvoKnit T-Shirt White,PUMA,noon,184.0,180.0,4.0,Women,White,Cotton Blend
Essential Sweatshirt White,adidas Originals,Namshi,275.0,275.0,0.0,Men,White,Cotton
Yusuke Surfers Tshirt Oil Green,VANS,noon,119.0,117.0,2.0,Men,Oil Green,Cotton
Design 2 Move High Rise Leggings Grey,adidas,Namshi,225.0,225.0,0.0,Women,Grey,Polyester
X Marvel Hulk Tshirt White,VANS,noon,109.0,70.0,39.0,Men,White,Cotton
Air Challenger 7in Shorts Blue Void/Reflective Silver,Nike,noon,170.0,127.0,43.0,Men,Blue Void/Reflective Silver,Polyester
Rise Up N Run Reflective Vest Black,adidas,noon,179.0,179.0,0.0,Women,Black,Polyester
3-Stripe Sweatpants Black,adidas,Namshi,239.0,239.0,0.0,Women,Black,Polyester
Design 2 Move Logo Print Tshirt Black,adidas,noon,129.0,83.0,46.0,Men,Black,Polyester Blend
Essential Camo Linear Logo T-Shirt Legend Ink/Collegiate Royal/Blue/Real Blue,adidas,noon,129.0,90.0,39.0,Men,Legend Ink/Collegiate Royal/Blue/Real Blue,NA
Es T- Shirt Bunker Blue/White,Reebok,noon,173.0,162.0,11.0,Men,Bunker Blue/White,Cotton
Running  Activchill Graphic Vest White,Reebok,noon,190.0,95.0,95.0,Women,White,NA
Mosaic Graphic T-Shirt Black/Graphite,UNDER ARMOUR,noon,129.0,120.0,9.0,Men,Black/Graphite,NA
Ufc Fg Fight For Yours T- Shirt Black,Reebok,noon,137.0,131.0,6.0,Men,Black,Cotton
Dri-Fit Training T-Shirt White/Black,Nike,noon,129.0,96.0,33.0,Men,White/Black,NA
Trefoil Leggings Black,adidas Originals,Namshi,135.0,135.0,0.0,Women,Black,Combination
Futura Icon Vest University Red/White,Nike,noon,130.0,97.0,33.0,Men,University Red/White,NA
Cf Mess You Up T- Shirt Black,Reebok,noon,137.0,128.0,9.0,Men,Black,Cotton
Classic Vector T-shirt Grey,Reebok,noon,165.0,149.0,16.0,Men,Grey,Cotton
Xtg Sweatpants Black,PUMA,Namshi,310.0,310.0,0.0,Men,Black,Polyester
Dri-Fit Seasonal Allover Print T-Shirt Cargo Khaki,Nike,noon,149.0,111.0,38.0,Men,Cargo Khaki,Polyester
NSW Heritage Hoodie Multicolour,Nike,Namshi,299.0,299.0,0.0,Women,Multicolour,80% Cotton 20% Polyester
Design2Move Logo T-Shirt Red,adidas,noon,115.0,80.0,35.0,Men,Red,NA
Flex 2 In 1 Training Shorts Black/Pink Quartz/White,Nike,noon,169.0,135.0,34.0,Women,Black/Pink Quartz/White,Polyester
Mosaic Graphic T-Shirt Grey,UNDER ARMOUR,noon,129.0,120.0,9.0,Men,Grey,NA
Sports Wear Solid T-Shirt Black,Nike,Namshi,299.0,209.0,90.0,Men,Black,Polyester
Sport ID 360 Jersey Tshirt Black,adidas,noon,140.0,135.0,5.0,Men,Black,NA
Cutout Cross Back Bra Puma Black,PUMA,noon,204.0,81.0,123.0,Women,Puma Black,Combination
Real Madrid Home Replica Shorts Core White/Black,adidas,noon,180.0,108.0,72.0,Men,Core White/Black,Polyester
Pro Leggings Black,Nike,noon,225.0,180.0,45.0,Women,Black,Polyester Blend
Dri-Fit Academy T-Shirt Green,Nike,Namshi,109.0,109.0,0.0,Men,Green,Polyester
Games Tie Logo Tank Top Navy,Reebok,noon,130.0,84.0,46.0,Men,Navy,Cotton
Twist Training T-Shirt Black/Reflective Silver,Nike,noon,199.0,149.0,50.0,Women,Black/Reflective Silver,NA
Alphaskin Sport Long Tights Blue,adidas,noon,205.0,133.0,72.0,Men,Blue,Polyester Blend
Cardio T-Shirt Black,Reebok,Namshi,290.0,160.0,130.0,Women,Black,Combination
Futura Flip Cropped T-Shirt Black,Nike,Namshi,149.0,149.0,0.0,Women,Black,Polyester
Futura Icon Vest Dk Grey Heather/Black,Nike,noon,130.0,97.0,33.0,Men,Dk Grey Heather/Black,NA
Design 2 Move Logo Print Tshirt Bliss Pink/White,adidas,noon,129.0,90.0,39.0,Women,Bliss Pink/White,NA
Nsw Essential Aop T-Shirt Brown/Black,Nike,Namshi,149.0,149.0,0.0,Women,Brown/Black,Cotton
FreeLift Badge Of Sport Logo Print Tshirt Blue,adidas,noon,169.0,135.0,34.0,Men,Blue,NA
Flex Stride 2-in-1 Shorts Red Crush,Nike,noon,225.0,147.0,78.0,Men,Red Crush,Polyester
Classic Pad Sports Bra Pistachio Frost/Black/Black,Nike,noon,179.0,125.0,54.0,Women,Pistachio Frost/Black/Black,Polyester Blend
Meet You There Printed Leggings Black,Reebok,noon,185.0,129.0,56.0,Women,Black,Cotton
Essentials Plain Tapered Stanford Pants Black,adidas,noon,215.0,139.0,76.0,Men,Black,Polyester
FreeLift Sport Ultimate Solid Tshirt Blue,adidas,noon,139.0,97.0,42.0,Men,Blue,NA
Classics T-Shirt Black,Reebok,noon,165.0,165.0,0.0,Men,Black,Cotton
Hero Brand Read Bra Blusla,Reebok,noon,185.0,74.0,111.0,Women,Blusla,NA
Graphic Today Counts T-Shirt Green,Reebok,Namshi,95.0,62.0,33.0,Women,Green,Cotton
MTS 3 Stripe Tracksuit Blue,adidas,Namshi,275.0,275.0,0.0,Men,Blue,Polyester
Breathe Squad Short Sleeves Jersey Gym Red,Nike,noon,405.0,222.0,183.0,Men,Gym Red,Polyester
Design 2 Move Logo Tshirt Glow Blue/White,adidas,noon,129.0,90.0,39.0,Women,Glow Blue/White,NA
Run Just Do It T-Shirt Echo Pink/White,Nike,noon,119.0,95.0,24.0,Women,Echo Pink/White,NA
Run Essentials T-Shirt Black,Reebok,noon,150.0,143.0,7.0,Men,Black,NA
Foundation T-Shirt White,UNDER ARMOUR,Namshi,129.0,129.0,0.0,Men,White,Polyester
Ac Ft Pants Medium Grey Heather,Reebok,noon,252.0,113.0,139.0,Women,Medium Grey Heather,Cotton
Must Have Badge Sport Hoodie Black,adidas,Namshi,199.0,199.0,0.0,Men,Black,Polyester
Essential Jersey Shorts Black,PUMA,Namshi,110.0,110.0,0.0,Men,Black,Cotton
Round Neck Short Sleeve T-Shirt Black,adidas,Namshi,115.0,115.0,0.0,Women,Black,Cotton
Classic Graphic T-shirt Black,Reebok,noon,130.0,117.0,13.0,Boys,Black,Cotton
Essentials Linear Jersey Vest Active Maroon/White,adidas,noon,99.0,64.0,35.0,Women,Active Maroon/White,Cotton
Workout Ready Strappy Bra Black,Reebok,Namshi,100.0,100.0,0.0,Women,Black,Polyester
Don't Rest Parley Bra Black,adidas,noon,229.0,160.0,69.0,Women,Black,NA
NSW Just Do It Swoosh T-Shirt Game Royal,Nike,noon,99.0,84.0,15.0,Boys,Game Royal,Cotton
Nike Indy Dazzle Sports Bra Black/White,Nike,noon,195.0,136.0,59.0,Women,Black/White,Nylon Blend
Air Challenger 7in Shorts Black/Reflective Silver,Nike,noon,149.0,119.0,30.0,Men,Black/Reflective Silver,Polyester
Young Boys Essentials  3-Stripes BR Pants Collegiate Navy,adidas,noon,190.0,171.0,19.0,Boys,Collegiate Navy,Combination
3 Piece Fc Barcelona 19/20 Home Set Blue/Red,Nike,Namshi,329.0,329.0,0.0,Kids Unisex,Blue/Red,Polyester
Trefoil Sleeveless Vest White/Blue,adidas Originals,noon,140.0,128.0,12.0,Women,White/Blue,NA
Dry-Fit Oversized T-Shirt Grey,Nike,noon,130.0,104.0,26.0,Women,Grey,Polyester Blend
Off Court Trefoil Bold 3 Stripes Hoodie Grey/Blue,adidas Originals,noon,385.0,288.0,97.0,Men,Grey/Blue,Cotton
D2M 3 Stripe T-Shirt Black,adidas,Namshi,135.0,135.0,0.0,Men,Black,Fabric
Kids Colorblock Logo T-Shirt Black/Dark Steel Grey/White/Black,Nike,noon,130.0,97.0,33.0,Boys,Black/Dark Steel Grey/White/Black,NA
Elevated Elements Brand T-Shirt Chalk Green,Reebok,noon,130.0,117.0,13.0,Men,Chalk Green,NA
Gs Rhythm Flow Easy T- Shirt Almost Grey,Reebok,noon,105.0,98.0,7.0,Women,Almost Grey,Cotton
Running Short Sleeve Tshirt Dark Grey Heather,Reebok,noon,155.0,77.0,78.0,Men,Dark Grey Heather,NA
Mesh Boxy Sport Tshirt Grey/White,adidas,noon,195.0,189.0,6.0,Women,Grey/White,Combination
Freelift Burnout Camo Print Tshirt Flash Orange,adidas,noon,169.0,118.0,51.0,Men,Flash Orange,NA
Dri-Fit Printed T-shirt Yellow/Black,Nike,noon,149.0,104.0,45.0,Men,Yellow/Black,NA
Trefoil Hoodie Red,adidas Originals,Namshi,325.0,325.0,0.0,Women,Red,Cotton
Classic Leather GP INT T-shirt Black,Reebok,noon,140.0,126.0,14.0,Boys,Black,Cotton
Jordan Shorts Black,Nike,Namshi,229.0,229.0,0.0,Men,Black,Polyester
Lineage ID Tshirt True Pink,adidas,noon,140.0,98.0,42.0,Women,True Pink,NA
Solid Colour Shorts Black,adidas,Namshi,165.0,165.0,0.0,Men,Black,Polyester
Fly Fast Printed Tight Legging Black/Breathtaking Blue/White,UNDER ARMOUR,noon,289.0,202.0,87.0,Women,Black/Breathtaking Blue/White,Combination
Just Do It T-Shirt Black,Nike,noon,120.0,84.0,36.0,Women,Black,NA
Infants Summer Set Multicolour,adidas,Namshi,149.0,149.0,0.0,Men,Multicolour,Cotton
Khabib T-Shirt Prints,Reebok,Namshi,165.0,115.0,50.0,Men,Prints,Cotton
Favorites Strappy Sports Bra Black,Nike,noon,169.0,118.0,51.0,Women,Black,NA
Equip Knit Short Tech Olive/Flash Orange,adidas,noon,115.0,80.0,35.0,Boys,Tech Olive/Flash Orange,Polyester
Munchy Star Chevron T-Shirt Black,CONVERSE,Namshi,109.0,109.0,0.0,Men,Black,Cotton
Adicolor 3 Striped Tshirt Black,adidas Originals,Namshi,135.0,135.0,0.0,Men,Black,Cotton
Tech Graphic T-Shirt Black,UNDER ARMOUR,Namshi,129.0,129.0,0.0,Women,Black,Polyester
Pro Rebel 7/8 Camo Leggings Camo,Nike,noon,229.0,183.0,46.0,Women,Camo,Polyester Blend
Kids French Terry Shorts Black/White,Nike,noon,149.0,111.0,38.0,Boys,Black/White,Cotton
NSW Just Do It Swoosh T-Shirt Dark Grey Heather,Nike,noon,99.0,84.0,15.0,Boys,Dark Grey Heather,NA
Supremium 2.0 T-Shirt White,Reebok,noon,100.0,90.0,10.0,Women,White,Combination
Camouflage Printed T-Shirt Anthracite/White/Black,Nike,SIVVI,129.0,91.9,37.1,Men,NA,Cotton
White NSW Air SS Top White,Nike,SIVVI,172.55,120.45,52.1,Women,White,Cotton
Classic T-Shirt White/Black,VANS,SIVVI,106.15,106.15,0.0,Men,White/Black,Cotton
Dri-Fit Cotton Shorts Black,Nike,Namshi,149.0,149.0,0.0,Men,Black,Combination
Must Haves Badge Of Sport Graphic Tshirt Legend Ink,adidas,noon,115.0,86.0,29.0,Men,Legend Ink,NA
4KRFT 3-Stripes Heather Sport Shorts Legend Ink/Heather,adidas,noon,155.0,108.0,47.0,Men,Legend Ink/Heather,Polyester
Dry Fleece Hybrid Shorts Black/Mtlc Hematite,Nike,noon,205.0,164.0,41.0,Men,Black/Mtlc Hematite,Polyester
Baseline Hooded T-Shirt Black,UNDER ARMOUR,Namshi,169.0,169.0,0.0,Men,Black,Combination
Essential Pique Polo T-Shirt Black,PUMA,Namshi,135.0,135.0,0.0,Men,Black,Cotton
Stronger For It Soft Moto Graphic Bra Blue,adidas,noon,279.0,167.0,112.0,Women,Blue,Polyester Blend
adicolor Superstar Sweatpants Black,adidas Originals,Namshi,325.0,325.0,0.0,Men,Black,Combination
Wor Activchill TechT- Shirt Cranberry Red,Reebok,noon,158.0,145.0,13.0,Men,Cranberry Red,Polyamide
Manchester United Home Jersey Beige,adidas,noon,409.0,409.0,0.0,Men,Beige,Polyester
UFC Khabib Portrait T-Shirt Black,Reebok,Namshi,125.0,125.0,0.0,Men,Black,Cotton
Ss Ac T- Shirt Black,Reebok,noon,215.0,198.0,17.0,Men,Black,Polyamide
Dry Miler T-Shirt Atmosphere Grey/Htr/Reflective Silver,Nike,SIVVI,169.0,120.45,48.55,Men,Atmosphere Grey/Htr/Reflective Silver,NA
Al Hilal Home Jersey 17-18 Prints,Nike,Namshi,419.0,105.0,314.0,Men,Prints,Polyester
Les Mills Graphic T-Shirt White,Reebok,noon,120.0,78.0,42.0,Men,White,Polyester
Sport Training Polo Shirt Marine,umbro,noon,152.0,126.0,26.0,Men,Marine,NA
Graphic Running T-shirt Electric Flash F17-R,Reebok,noon,150.0,131.0,19.0,Men,Electric Flash F17-R,Polyester
Indy Floral Longline Sports Bra White/Gunsmoke,Nike,noon,195.0,136.0,59.0,Women,White/Gunsmoke,Polyester Blend
Jordan Jumpman T-Shirt Black,Nike,Namshi,149.0,149.0,0.0,Men,Black,Cotton
3-Stripes Shorts Black,adidas Originals,noon,245.0,159.0,86.0,Men,Black,Cotton
FreeLift Moto Pack Tshirt White,adidas,Namshi,209.0,209.0,0.0,Men,White,Polyester
4KRFT Sport Striped Heather Shorts Black,adidas,noon,169.0,126.0,43.0,Men,Black,Polyester
6 Piece No Show Socks White/Grey,SKECHERS,Namshi,40.0,40.0,0.0,Women,White/Grey,Combination
I See You Badge Of Sport T-Shirt White,adidas,noon,115.0,80.0,35.0,Women,White,NA
Te Polo T-Shirt Blue Slate,Reebok,noon,184.0,169.0,15.0,Men,Blue Slate,Cotton
Sport ID Jersey Tshirt White,adidas,noon,139.0,104.0,35.0,Men,White,Cotton
Miler Tech Running T-Shirt Black/Htr/Black/Reflective Silv,Nike,noon,170.0,136.0,34.0,Men,Black/Htr/Black/Reflective Silv,NA
Just Do It Vest Dark Grey Heather,Nike,noon,129.0,96.0,33.0,Men,Dark Grey Heather,NA
Must Haves Badge Of Sport Vest Black,adidas,Namshi,115.0,115.0,0.0,Men,Black,Cotton
Workout Ready Leggings Black,Reebok,Namshi,130.0,130.0,0.0,Women,Black,Combination
Infant Disney Spiderman Set Multicolour,adidas,Namshi,175.0,122.0,53.0,Boys,Multicolour,Cotton
Pro Intertwist 2.0 Leggings Oil Grey/Htr/Thunder Grey,Nike,noon,255.0,191.0,64.0,Women,Oil Grey/Htr/Thunder Grey,Polyester Blend
Write Records T-Shirt Grey,UNDER ARMOUR,noon,129.0,90.0,39.0,Men,Grey,Cotton Blend
Mesh Leggings Navy,Reebok,Namshi,185.0,185.0,0.0,Women,Navy,Polyester
Design2Move Logo T-Shirt Tech Ink,adidas,noon,115.0,80.0,35.0,Men,Tech Ink,NA
adicolor Adibreak Sweatpants Black,adidas Originals,Namshi,325.0,227.0,98.0,Women,Black,Polyester
3-Stripes Leggings Grey,adidas Originals,noon,139.0,83.0,56.0,Women,Grey,Cotton Blend
Design 2 Move 3 Stripes Tshirt White,adidas,noon,129.0,90.0,39.0,Men,White,Polyester Blend
X Spitfire Tshirt Black,VANS,noon,135.0,132.0,3.0,Men,Black,NA
4KRFT Sports Graphic Shorts Blue,adidas,noon,169.0,126.0,43.0,Men,Blue,Polyester Blend
Set Of 6 Breathable Socks Black,adidas,noon,92.0,90.0,2.0,Kids Unisex,Black,NA
Nsw T-Shirt Red,Nike,noon,129.0,103.0,26.0,Men,Red,NA
Must Haves Foil Print Tshirt Glow Pink,adidas,noon,129.0,90.0,39.0,Women,Glow Pink,Cotton
ID Graphic Woven Pants Grey,adidas,noon,279.0,195.0,84.0,Men,Grey,Polyester
Les Mills Hero Strappy Bra Washed Blue S18-R,Reebok,noon,185.0,83.0,102.0,Women,Washed Blue S18-R,NA
Long Sleeve Sport Tshirt White,adidas Originals,noon,245.0,224.0,21.0,Men,White,Cotton Blend
Round Neck Short Sleeve T-Shirt Pink,adidas,Namshi,125.0,125.0,0.0,Girls,Pink,Polyester
Dri-Fit Logo T-Shirt Green,Nike,Namshi,149.0,149.0,0.0,Men,Green,Polyester
Round Neck Short Sleeve T-Shirt Navy,adidas,Namshi,165.0,165.0,0.0,Men,Navy,Polyester
Classicss Hoodie Green,Reebok,Namshi,310.0,310.0,0.0,Men,Green,Polyester
Air Long Sleeve T-Shirt Dk Grey Heather/Black,Nike,noon,129.0,83.0,46.0,Women,Dk Grey Heather/Black,Cotton
Classic T-Shirt Navy,VANS,SIVVI,106.15,106.15,0.0,Men,Navy,Cotton
Athletics Emblem Tshirt Blue,adidas,noon,115.0,112.0,3.0,Women,Blue,Cotton
Ss Reflective T- Shirt Twisted Berry F18-R,Reebok,noon,215.0,201.0,14.0,Women,Twisted Berry F18-R,Polyester
3 Stripe Polo White,adidas,Namshi,165.0,165.0,0.0,Men,White,Polyester
Graphic T-Shirt White,Reebok,noon,150.0,97.0,53.0,Men,White,Polyester Blend
2-1 Shorts Collegiate Navy,Reebok,noon,194.0,87.0,107.0,Men,Collegiate Navy,Polyester
Run Graphic T-Shirt Black,Reebok,noon,150.0,142.0,8.0,Men,Black,NA
CrossFit Science Weight T-Shirt Black,Reebok,noon,130.0,127.0,3.0,Men,Black,NA
Kids FC Barcelona Stadium Home 2018-2019 Jersey Red/Blue/Yellow,Nike,noon,305.0,167.0,138.0,Kids Unisex,Red/Blue/Yellow,NA
Sport ID Jersey Tshirt,adidas,noon,115.0,112.0,3.0,Men,NA,Cotton
NSW Swoosh Sweatshirt University Red/Obsidian/White,Nike,noon,329.0,279.0,50.0,Men,University Red/Obsidian/White,NA
Court Dry Fit Polo T-Shirt White,Nike,noon,219.0,175.0,44.0,Men,White,NA
Graphic T-Shirt Black,PUMA,noon,184.0,180.0,4.0,Men,Black,Polyester
Essential 3 Stripe Leggings Black,adidas,Namshi,150.0,149.0,1.0,Women,Black,Combination
Sportswear Club Fleece Midnight Navy/Midnight Navy/White,Nike,noon,229.0,217.0,12.0,Men,Midnight Navy/Midnight Navy/White,Cotton Blend
Swoosh Rebel Just Do It Sports Bra Burnt Sienna/Black,Nike,noon,195.0,136.0,59.0,Women,Burnt Sienna/Black,NA
All Over Print Jacket Multicolour,adidas Originals,noon,329.0,213.0,116.0,Women,Multicolour,Polyester Blend
Wor Myt Mesh Layer Piece T- Shirt White,Reebok,noon,158.0,149.0,9.0,Women,White,Polyamide
PWRUN FAST Bra Top Soft Fluo Peach Heather,PUMA,noon,235.0,185.3,49.7,Women,Soft Fluo Peach Heather,Polyester
Checker Company II Tshirt Ash Heather,VANS,noon,89.0,62.0,27.0,Men,Ash Heather,Cotton Blend
Real Madrid Jersey Red,adidas,Namshi,400.0,160.0,240.0,Men,Red,Polyester
Must Haves Badge Of Sport Logo Print Tshirt Navy Blue,adidas,noon,129.0,83.0,46.0,Men,Navy Blue,Cotton
Badge Of Sport Logo Print Tshirt Pink,adidas,noon,155.0,100.0,55.0,Women,Pink,Polyester
Jordan Jumpman Shimmer Shorts Black,Nike,noon,170.0,127.0,43.0,Men,Black,Polyester
NightCat Shorts Puma Black,PUMA,noon,200.0,50.0,150.0,Women,Puma Black,Polyester Blend
Sport ID Logo Print Tshirt Legend Earth,adidas,noon,139.0,97.0,42.0,Women,Legend Earth,Cotton
Dri-Fit Elastika Vest Grey,Nike,noon,150.0,105.0,45.0,Women,Grey,Polyester
NSW Solid Pattern  T-shirt University Red/Black,Nike,SIVVI,152.1,106.15,45.95,Men,University Red/Black,Cotton
Varsity Block Vest Black,Nike,noon,129.0,90.0,39.0,Women,Black,Cotton
Short Sleeve Bodega Super A T-Shirt Black,adidas Originals,SIVVI,137.85,97.0,40.85,Men,Black,Combination
Essential Fitness Sweatpants Black,Reebok,noon,255.0,153.0,102.0,Women,Black,Polyester
Air Brushed Fleece T-Shirt White/Black,Nike,noon,169.0,109.0,60.0,Women,White/Black,Cotton
The Rock Dues Graphic T-Shirt Navy,UNDER ARMOUR,Namshi,149.0,149.0,0.0,Women,Navy,Polyester
Sport ID Jersey Tshirt Medium Grey Heather/Matte Gold,adidas,noon,139.0,97.0,42.0,Men,Medium Grey Heather/Matte Gold,NA
Running Climalite Tshirt Collegiate Royal,adidas,noon,129.0,90.0,39.0,Men,Collegiate Royal,NA
Dri-Fit Miler T-Shirt Green,Nike,noon,149.0,104.0,45.0,Men,Green,Polyester
3 Stripe T-Shirt Yellow,adidas Originals,Namshi,135.0,135.0,0.0,Men,Yellow,Cotton
Workout Ready Supremium 2.0 T-Shirt Stellar Pink,Reebok,noon,100.0,90.0,10.0,Women,Stellar Pink,NA
Must Have Badge Of Sport Hoodie Black,adidas,Namshi,275.0,275.0,0.0,Women,Black,Polyester
Running Climalite Tshirt Black,adidas,Namshi,125.0,125.0,0.0,Men,Black,Combination
Nsw Leg-A-See Flip Leggings Black,Nike,Namshi,169.0,169.0,0.0,Women,Black,Polyester
Youth Adicolor Trefoil Shorts Mint Green,adidas Originals,Namshi,135.0,81.0,54.0,Girls,Mint Green,Combination
Foundations Training T-Shirt Crushed Cobalt,Reebok,noon,120.0,114.0,6.0,Men,Crushed Cobalt,NA
Jordan Jumpman Fleeve Pullover Hoodie Carbon Heather/Black,Nike,noon,335.0,268.0,67.0,Men,Carbon Heather/Black,NA
Must Have 3 Stripe T-Shirt Grey,adidas,Namshi,135.0,135.0,0.0,Men,Grey,Cotton
Wor Activchill Graphic T-Shirt Black,Reebok,noon,150.0,135.0,15.0,Men,Black,NA
NSW Essential Fleece Sweatshirt Black,Nike,Namshi,269.0,269.0,0.0,Women,Black,80% Cotton 20% Polyester
Pure Dolphin Hemmed Skirt White,Nike,noon,183.0,109.0,74.0,Women,White,NA
Design 2 Move 3 Stripe Vest Bliss Pink/White,adidas,noon,129.0,90.0,39.0,Women,Bliss Pink/White,NA
Running Graphic T-Shirt Blue,Reebok,noon,150.0,135.0,15.0,Men,Blue,NA
Power Shape Forever Graphic Sports Bra Puma Black-Run,PUMA,noon,235.0,105.0,130.0,Women,Puma Black-Run,Combination
Burgundy Classic T-Shirt Burgundy/Whi,VANS,SIVVI,106.15,106.15,0.0,Men,Burgundy/Whi,Cotton
Sport ID Logo Print Tshirt Off/White,adidas,Namshi,240.0,168.0,72.0,Men,Off/White,Combination
Classic Vector Hoodie Black,Reebok,noon,330.0,169.8,160.2,Men,Black,Cotton
Logo Tape T-Shirt Dk Grey Heather/Photo Blue/White,Nike,noon,129.0,126.0,3.0,Women,Dk Grey Heather/Photo Blue/White,Cotton
Nsw T-Shirt Light Blue,Nike,noon,129.0,103.0,26.0,Men,Light Blue,NA
Air Vest Black/White,Nike,noon,149.0,104.0,45.0,Women,Black/White,NA
Training Speedwick Move T-shirt Black,Reebok,noon,150.0,135.0,15.0,Men,Black,Combination
Kids Barcelona FC Casual Shorts Blue,Nike,noon,170.0,93.0,77.0,Boys,Blue,NA
Sportswear Fleece Sweatpants Dk Grey Heather/White,Nike,noon,229.0,171.0,58.0,Women,Dk Grey Heather/White,Cotton Blend
Pro Compression T-Shirt White/Black/Black,Nike,noon,170.0,127.0,43.0,Men,White/Black/Black,NA
Jumbo Futura T-Shirt Black,Nike,Namshi,69.0,69.0,0.0,Girls,Black,Fabric
Alphaskin Long Moto Leggings Blue,adidas,noon,245.0,159.0,86.0,Women,Blue,Polyester Blend
Tiro 19 Sweatpants Blue,adidas,Namshi,190.0,133.0,57.0,Men,Blue,Polyester
Air Challenger 7in Shorts Indigo Force/Reflective Silver,Nike,noon,170.0,119.0,51.0,Men,Indigo Force/Reflective Silver,Polyester
NSW Just Do It Swoosh T-Shirt White,Nike,noon,99.0,79.0,20.0,Boys,White,NA
Team Signature Fleece Hoodie Blue,adidas Originals,noon,385.0,201.25,183.75,Men,Blue,Cotton Blend
Strappy Climalite Cami Grey,adidas,Namshi,175.0,122.0,53.0,Women,Grey,Combination
Believe This Wanderlust Leggings Glow Blue/Black,adidas,noon,385.0,231.0,154.0,Women,Glow Blue/Black,Polyester Blend
6 Piece Unisex Low Cut Socks White,SKECHERS,Namshi,45.0,45.0,0.0,Men,White,Combination
Own The Run Cooler Tank Black/Heather,adidas,noon,139.0,139.0,0.0,Women,Black/Heather,NA
TS Trefoil Shorts Blue,adidas Originals,noon,245.0,171.0,74.0,Men,Blue,Cotton Blend
Lock Up T-Shirt Red,adidas Originals,Namshi,135.0,135.0,0.0,Women,Red,NA
Jordan Jumpman Graphic Shorts Red,Nike,Namshi,229.0,229.0,0.0,Men,Red,Polyester
Rival Fleece Sportstyle Graphic Hoodie Steel Medium Heather/Black,UNDER ARMOUR,noon,209.0,167.0,42.0,Women,Steel Medium Heather/Black,Cotton Blend
3-Stripes Stronger For It Bra Black,adidas,noon,305.0,183.0,122.0,Women,Black,Polyester Blend
Elevated Running T-Shirt Black,Reebok,noon,205.0,191.0,14.0,Men,Black,NA
Te Marble Group T- Shirt Teal Fog,Reebok,noon,126.0,121.0,5.0,Men,Teal Fog,Cotton
Sport Id T-Shirt Grey,adidas,Namshi,135.0,135.0,0.0,Men,Grey,Cotton
Essential Linear Leggings Black,adidas,Namshi,135.0,135.0,0.0,Women,Black,Combination
NSW Swoosh Sweatpants Blue,Nike,Namshi,329.0,329.0,0.0,Men,Blue,"80% Cotton,20% Polyester"
Yoga Striped Bra Laser Red/White,Reebok,noon,195.0,78.0,117.0,Women,Laser Red/White,NA
High Waist Ankle Leggings Black,adidas,Namshi,189.0,189.0,0.0,Men,Black,Polyester
Ultimate High Rise 3/4 Tights White/Black,adidas,noon,255.0,140.0,115.0,Women,White/Black,Combination
Training T-Shirt Ember Glow/Htr/Black,Nike,noon,149.0,146.0,3.0,Women,Ember Glow/Htr/Black,Cotton
Crossfit Move T-Shirt Bunker Blue,Reebok,noon,185.0,167.0,18.0,Men,Bunker Blue,NA
Club Printed Waistand Leggings Dark Grey,Nike,noon,149.0,111.0,38.0,Women,Dark Grey,Cotton
Classics Contrast Pocket T-Shirt Navy,Reebok,noon,155.0,77.0,78.0,Men,Navy,NA
Essentials Linear Logo Tshirt Grey,adidas,Namshi,99.0,99.0,0.0,Men,Grey,Polyester
Lux Color Block Leggings Bunker Blue/Black,Reebok,noon,260.0,104.0,156.0,Women,Bunker Blue/Black,Polyamide Blend
Trefoil Logo Print Tshirt Light Grey,adidas,noon,155.0,108.0,47.0,Men,Light Grey,Cotton
Cotton Trefoil Hoodie Black,adidas Originals,Namshi,239.0,239.0,0.0,Men,Black,Cotton
Sport ID Logo Print Tshirt Black,adidas,noon,139.0,97.0,42.0,Women,Black,Cotton
Long Sleeve Bodega Hoodie Black,adidas Originals,SIVVI,382.9,268.55,114.35,Men,Black,Combination
Chelsea FC Stadium Home Jersey Rush Blue/White,Nike,noon,407.0,244.0,163.0,Men,Rush Blue/White,NA
Dri-Fit Tapered Fleece Camo Pants Dark Green,Nike,noon,229.0,183.0,46.0,Men,Dark Green,Polyester
ID Graphic Hoodie Grey,adidas,noon,329.0,213.0,116.0,Men,Grey,Cotton Blend
Dont Rest 3 Stripe Bra Black,adidas,noon,129.0,90.0,39.0,Women,Black,Polyester Blend
Running  Activchill Tank Twisted Berry F18-R,Reebok,noon,135.0,135.0,0.0,Women,Twisted Berry F18-R,NA
Graphic Print Tshirt White,adidas,noon,115.0,74.0,41.0,Women,White,Cotton
Workout Ready Fleece Hoodie Black,Reebok,Namshi,290.0,290.0,0.0,Men,Black,Polyester
Victory Compression Bra Black,Nike,noon,132.0,112.0,20.0,Women,Black,Polyester Blend
