name,brand,sold_by,old_price,current_price,saving,section,color,material
Colorblock Logo T-Shirt Blue Void/Game Royal/White,Nike,noon,129.0,103.0,26.0,Boys,Blue Void/Game Royal/White,NA
Futura Swoosh Bra Pink Quartz/White,Nike,noon,159.0,127.0,32.0,Women,Pink Quartz/White,NA
Franchise Shorts Black,Nike,Namshi,169.0,169.0,0.0,Men,Black,Polyester
3 Piece Inner Socks Black,SKECHERS,Namshi,35.0,35.0,0.0,Women,Black,Combination
Run It Climalite Vest Glow Blue,adidas,noon,139.0,139.0,0.0,Women,Glow Blue,Polyester Blend
Just Do It Fleece SweaT-Shirt Grey Heather,Nike,noon,305.0,228.0,77.0,Men,Grey Heather,Cotton Blend
Matcho 4 Tipped Polo Navy,FILA,Namshi,217.0,217.0,0.0,Men,Navy,Cotton
Hangtag Swoosh T-Shirt Black/Anthracite/(Grey),Nike,noon,169.0,166.0,3.0,Men,Black/Anthracite/(Grey),Polyester
Short Sleeve Solid Tshirt Active Green,adidas,noon,130.0,91.0,39.0,Men,Active Green,Polyester
NSW Leg-A-See Just Do It Leggings Pink Quartz/White,Nike,noon,169.0,126.0,43.0,Women,Pink Quartz/White,Cotton Blend
Believe This 3-Stripes Leggings Grey,adidas,noon,329.0,197.0,132.0,Women,Grey,Polyester Blend
The Rock Armour Mid Crossback Bra Grey,UNDER ARMOUR,Namshi,199.0,199.0,0.0,Women,Grey,Polyester
Freelift Easy Tech Hoodie Grey,adidas,Namshi,165.0,165.0,0.0,Men,Grey,Polyester
Indy Air Graphic Sports Bra Black,Nike,noon,195.0,136.0,59.0,Women,Black,NA
All In Cropped Tights Black/White,Nike,noon,169.0,135.0,34.0,Women,Black/White,Polyester Blend
Energy Seamless T-Shirt,PUMA,noon,140.0,77.0,63.0,Men,NA,NA
Big Print Sportswear Sweatpants Grey,Nike,noon,299.0,224.0,75.0,Men,Grey,Polyester
Rafa Ace Shorts Gridiron/Pure Platinum,Nike,noon,336.0,201.0,135.0,Men,Gridiron/Pure Platinum,Polyester
24/7 Woven Cuffed Track Suit Black,adidas,noon,305.0,213.0,92.0,Men,Black,Polyester
All Me Badge Of Sport Bra Pink,adidas,noon,129.0,90.0,39.0,Women,Pink,Polyester Blend
One Printed Training Leggings Black/Gunsmoke,Nike,noon,199.0,149.0,50.0,Women,Black/Gunsmoke,Polyester Blend
Dri-FIT Fleece Just Do It T-Shirt Pink Quartz/Black,Nike,noon,299.0,239.0,60.0,Women,Pink Quartz/Black,Polyester
Essential Jersey Shorts Grey,PUMA,Namshi,110.0,110.0,0.0,Men,Grey,Cotton
3-Striped Shorts Black,adidas Originals,Namshi,239.0,239.0,0.0,Men,Black,Cotton
Outline Logo Tshirt Legend Ink,adidas Originals,noon,139.0,97.0,42.0,Men,Legend Ink,NA
Design 2 Move 3-Stripes High-Rise Long Leggings Black/White,adidas,noon,205.0,143.0,62.0,Women,Black/White,Polyester Blend
Response Tee T-Shirt Grey,adidas,noon,170.0,119.0,51.0,Women,Grey,NA
Camouflage Mix Tshirt Multicolour,adidas Originals,noon,169.0,118.0,51.0,Men,Multicolour,Cotton
Graphic T-Shirt Chalk Green,Reebok,noon,185.0,175.0,10.0,Men,Chalk Green,NA
Adicolor Trefoil Tshirt Black,adidas Originals,Namshi,135.0,135.0,0.0,Men,Black,Cotton
Cropped All Over Print Tshirt Multicolour,adidas Originals,noon,139.0,90.0,49.0,Women,Multicolour,Cotton
Trefoil Tshirt Noble Green/White,adidas Originals,noon,139.0,111.0,28.0,Men,Noble Green/White,NA
Three Quarter Tights Grey/Black,adidas,Namshi,175.0,175.0,0.0,Men,Grey/Black,Fabric
Mini Futura Air T-Shirt Black,Nike,noon,129.0,90.0,39.0,Men,Black,Cotton
Tango Graphic Print Tshirt Black,adidas,noon,115.0,80.0,35.0,Men,Black,Cotton
Los Angeles Lakers Jacket Black,Nike,Namshi,569.0,569.0,0.0,Men,Black,Fabric
Wor Melange Tech T- Shirt Bunker Blue,Reebok,noon,126.0,118.0,8.0,Men,Bunker Blue,Polyester
Swoosh Core T-Shirt Black,Nike,noon,129.0,90.0,39.0,Men,Black,Cotton
Graphic Sunset Sweatshirt Legend Ink/Flash Orange,adidas Originals,noon,215.0,161.0,54.0,Men,Legend Ink/Flash Orange,NA
QQR Linear Read T-Shirt White,Reebok,Namshi,95.0,95.0,0.0,Men,White,Cotton
Mk1 Wordmark Sweatshirt Black,UNDER ARMOUR,Namshi,199.0,199.0,0.0,Men,Black,Fabric
Air Challenger 7in Shorts Black,Nike,noon,149.0,111.0,38.0,Men,Black,Polyester
Elements Marble T-Shirt Black,Reebok,noon,120.0,108.0,12.0,Men,Black,NA
Salah Player Tshirt Black,adidas,noon,115.0,80.0,35.0,Men,Black,Cotton
Nsw Heritage Mesh T-Shirt Black,Nike,Namshi,149.0,149.0,0.0,Women,Black,Polyester
Meet You There Low Impact Bra Black,Reebok,noon,130.0,91.0,39.0,Women,Black,Polyamide
Kids Training Tights Black,adidas,noon,129.0,90.0,39.0,Girls,Black,Cotton Blend
RC Move T- Shirt Medium Grey Heather,Reebok,noon,194.0,186.0,8.0,Men,Medium Grey Heather,Polyester
Kids Sportswear Woven Shorts Black,Nike,noon,129.0,96.0,33.0,Boys,Black,Polyester
Short Sleeve Bodega Pricetag T-Shirt White,adidas Originals,SIVVI,137.85,97.0,40.85,Men,White,Combination
ID Photo T-Shirt Raw Khaki,adidas,noon,140.0,135.0,5.0,Men,Raw Khaki,NA
Running Vest Black,Nike,noon,90.0,72.0,18.0,Women,Black,NA
Camouflage Mix Tshirt White,adidas Originals,noon,139.0,97.0,42.0,Men,White,Cotton
Rebel Bold T-Shirt Navy,PUMA,Namshi,110.0,110.0,0.0,Men,Navy,Cotton
NSW Swoosh Sweatpants Black,Nike,Namshi,299.0,299.0,0.0,Men,Black,Polyester
Move T-Shirt Grey,Reebok,noon,150.0,150.0,0.0,Men,Grey,Cotton
Kaval Set White,adidas Originals,Namshi,240.0,240.0,0.0,Men,White,Cotton
Ac Milan 1899 Polo T-Shirt Black,PUMA,Namshi,225.0,225.0,0.0,Men,Black,Cotton
Short Sleeve Camo T-Shirt Multco/Carbon,adidas Originals,SIVVI,137.85,97.0,40.85,Men,Multco/Carbon,Combination
Workout Ready Knit Shorts Grey,Reebok,Namshi,130.0,91.0,39.0,Men,Grey,Polyester
Round Neck Logo Printed T-Shirt Black,adidas,Namshi,165.0,165.0,0.0,Men,Black,Polyester
Kids Super A Graphic Tshirt Black,adidas Originals,Namshi,115.0,115.0,0.0,Men,Black,Cotton
Round Neck Short Sleeve T-Shirt Black,adidas,Namshi,125.0,125.0,0.0,Men,Black,Cotton
ID Graphic Tshirt Black,adidas,noon,179.0,179.0,0.0,Men,Black,Cotton
Workout Ready Detail Tank Blue,Reebok,Namshi,100.0,100.0,0.0,Women,Blue,Polyester
Sportswear Club Fleece Black/Black/White,Nike,noon,229.0,194.0,35.0,Men,Black/Black/White,Cotton Blend
Linear Logo T-Shirt Black,Reebok,Namshi,95.0,95.0,0.0,Women,Black,Cotton
MTS Relax Tracksuit Grey,adidas,Namshi,375.0,375.0,0.0,Men,Grey,Combination
Kids Air Sweatpants Blue Void/White/University Red/White,Nike,noon,255.0,178.0,77.0,Boys,Blue Void/White/University Red/White,Cotton Blend
Must Haves Badge of Sport Shorts Black,adidas,noon,169.0,118.0,51.0,Men,Black,Cotton Blend
Manchester United FC Away Jersey Icey Pink F17/Trace Pink F17/Black,adidas,noon,400.0,240.0,160.0,Men,Icey Pink F17/Trace Pink F17/Black,Polyester
Kids Dri-Fit Neymar T-Shirt Black/Laser Crimson/White,Nike,noon,129.0,103.0,26.0,Boys,Black/Laser Crimson/White,Polyester
Sportstyle Hoodie Black,UNDER ARMOUR,Namshi,229.0,229.0,0.0,Men,Black,Polyester
Pro Compression T-Shirt White,Nike,Namshi,180.0,180.0,0.0,Men,White,Combination
Freelift Burnout Camo Print Tshirt Black,adidas,noon,169.0,118.0,51.0,Men,Black,NA
ID 3 Stripes Sweatpants Black,adidas,Namshi,325.0,227.0,98.0,Women,Black,Combination
Essentials Linear Tshirt Black,adidas,Namshi,75.0,75.0,0.0,Kids Unisex,Black,Cotton
Jordan Jumpman Classic T-Shirt Black,Nike,Namshi,149.0,149.0,0.0,Men,Black,Cotton
F.C. Hoodie Grey,Nike,Namshi,389.0,389.0,0.0,Men,Grey,75% Polyester 13% Cotton 12% Viscose
Classics Contrast Pocket T-Shirt Grey,Reebok,noon,155.0,77.0,78.0,Men,Grey,NA
Sportswear Essential Hoodie Black,Nike,Namshi,299.0,299.0,0.0,Women,Black,80% Cotton 20% Polyester
Sport Lab Contrast T-Shirt Grey/Black,umbro,noon,131.0,112.0,19.0,Men,Grey/Black,NA
Speedpocket Linerless Shorts Black/Orange,UNDER ARMOUR,noon,200.0,130.0,70.0,Men,Black/Orange,Polyester
Pace EvoKNIT Move Full Zip Hoodie Black,PUMA,noon,620.0,488.95,131.05,Men,Black,Combination
Floral Allover Print T-Shirt Dress Multicolour,adidas Originals,noon,195.0,126.0,69.0,Women,Multicolour,Polyester
Supremium Graphic T-shirt Black,Reebok,noon,120.0,114.0,6.0,Men,Black,Combination
Tango Sweatpants Black,adidas,Namshi,275.0,179.0,96.0,Men,Black,Polyester
Mascot Jersey Tshirt,adidas,noon,115.0,86.0,29.0,Men,NA,Cotton
Print Box Tshirt Blue,VANS,noon,109.0,107.0,2.0,Men,Blue,Cotton
Youth Flower Shorts Multicolour,adidas Originals,noon,139.0,83.0,56.0,Girls,Multicolour,Cotton Blend
Just Do It Camo Sweatpants Cool Grey/Anthracite/White,Nike,noon,299.0,194.0,105.0,Men,Cool Grey/Anthracite/White,Cotton
Badge Of Sport Shaped Hem Vest Black,adidas,noon,155.0,108.0,47.0,Women,Black,Polyester
Future Dunker Graphic Tshirt Black,adidas,noon,130.0,91.0,39.0,Men,Black,NA
Vanish Printed Tights Radio Red,UNDER ARMOUR,noon,215.0,139.0,76.0,Women,Radio Red,"59% Polyester,41% Elasterell P"
Run Essential T-Shirt Neon Lime,Reebok,noon,150.0,135.0,15.0,Men,Neon Lime,NA
Run Essential T-Shirt Neon Lime,Reebok,noon,130.0,117.0,13.0,Men,Neon Lime,NA
Essentials Linear T-Shirt Legend Ink/White,adidas,noon,99.0,69.0,30.0,Men,Legend Ink/White,NA
Futura Icon Cropped Top Pink Quartz,Nike,noon,129.0,96.0,33.0,Women,Pink Quartz,NA
FC Bayern Home Jersey Red/White,adidas,noon,410.0,267.0,143.0,Men,Red/White,NA
Youth Essential Linear Hoodie Pink,adidas,Namshi,189.0,189.0,0.0,Women,Pink,Polyester
Wor Activchill Graph Ss T- Shirt Mineral Mist,Reebok,noon,158.0,151.0,7.0,Men,Mineral Mist,Polyamide
Court Dry Fit Polo T-Shirt Black,Nike,noon,219.0,175.0,44.0,Men,Black,NA
NSW Icon Futura Vest Red,Nike,SIVVI,131.7,91.9,39.8,Men,Red,Cotton
Mesh Leggings Black,Reebok,Namshi,185.0,185.0,0.0,Women,Black,Combination
10K Breathe T-Shirt Pink,Nike,noon,169.0,126.0,43.0,Women,Pink,Polyester Blend
Ac F Dis Pants Black,Reebok,noon,284.0,170.0,114.0,Men,Black,Cotton
Sportswear Club Fleece Dk Grey Heather/Matte Silver/White,Nike,noon,235.0,188.0,47.0,Men,Dk Grey Heather/Matte Silver/White,Cotton Blend
Victory Vest Black,Nike,noon,112.0,89.0,23.0,Women,Black,NA
Real Madrid Home Shorts Core White/Black,adidas,noon,155.0,93.0,62.0,Boys,Core White/Black,NA
ID Graphic Hoodie Black,adidas,Namshi,325.0,325.0,0.0,Men,Black,Polyester
Polyester Floral Leggings Black,adidas Originals,Namshi,165.0,165.0,0.0,Women,Black,Polyester
Classic Crop T-Shirt Black,Reebok,noon,165.0,149.0,16.0,Women,Black,NA
Blast Graphic 3 Shorts Black-White Euphoria,PUMA,noon,184.0,184.0,0.0,Women,Black-White Euphoria,Polyester Blend
Rc Activchill T- Shirt White,Reebok,noon,215.0,201.0,14.0,Women,White,Polyamide
Superstar Sweatpants Blue,adidas Originals,noon,329.0,246.0,83.0,Men,Blue,Polyester Blend
Muscle Tank Vest White,Reebok,noon,100.0,100.0,0.0,Women,White,Modal Blend
Breathe Light Sports Bra Black/Black/White,Nike,noon,195.0,136.0,59.0,Women,Black/Black/White,Nylon Blend
Must Haves 3 Stripe Tshirt Grey,adidas,noon,139.0,90.0,49.0,Men,Grey,Cotton
Must Have Badge Of Sports Tshirt Burgundy,adidas,Namshi,115.0,115.0,0.0,Men,Burgundy,Cotton
Sportswear Optic Sweatpants Black,Nike,noon,335.0,251.0,84.0,Men,Black,Cotton Blend
Dont Cross Me Bra Puma Black,PUMA,noon,210.0,105.0,105.0,Women,Puma Black,Polyester Blend
Mosaic Graphic T-Shirt White,UNDER ARMOUR,noon,129.0,120.0,9.0,Men,White,NA
Alphaskin Badge Of Sport Leggings Black/Grey,adidas,noon,215.0,139.0,76.0,Women,Black/Grey,Polyester Blend
Indy Air Graphic Sports Bra China Rose/Black,Nike,noon,195.0,136.0,59.0,Women,China Rose/Black,NA
Graphic Printed T-Shirt White/Black,Reebok,noon,140.0,126.0,14.0,Men,White/Black,NA
Dri-FIT Breathe Short Sleeve Training T-Shirt Anthracite,Nike,noon,185.0,111.0,74.0,Men,Anthracite,NA
Real Madrid Polo Black,adidas,Namshi,209.0,209.0,0.0,Men,Black,Polyester
Printed Stripe Socks White,PUMA,noon,45.0,23.0,22.0,Men,White,Cotton Blend
Baseline Fleece Sweatpants Black,UNDER ARMOUR,Namshi,269.0,269.0,0.0,Men,Black,Polyester
Must Haves Badge Of Sport Foil Tshirt White,adidas,Namshi,125.0,125.0,0.0,Men,White,Cotton
Breathe Light Sports Bra Echo Pink/Juniper Fog/Black,Nike,noon,195.0,136.0,59.0,Women,Echo Pink/Juniper Fog/Black,Nylon Blend
Kids No Show Cushion Socks 3 pk White,Nike,noon,60.0,51.0,9.0,Kids Unisex,White,73% Cotton; 23% Nylon; 3% Spandex; 1% Polyester
Celebrate The 90'S Sweatpants Blue,adidas,Namshi,249.0,249.0,0.0,Men,Blue,Polyester
Rebel Vest Grey,Nike,noon,149.0,111.0,38.0,Women,Grey,NA
Run Graphic T-Shirt White,Reebok,noon,150.0,142.0,8.0,Men,White,NA
Gp Q1 Ss Crew T- Shirt Black,Reebok,noon,194.0,181.0,13.0,Women,Black,Cotton
Workout Ready Tech T-Shirt White,Reebok,Namshi,100.0,70.0,30.0,Men,White,Polyester
PSG Pre-Match Training T-Shirt White,Nike,noon,269.0,215.0,54.0,Men,White,NA
Air Challenger 7in Shorts Black,Nike,noon,169.0,126.0,43.0,Men,Black,Polyester
JDI Swoosh T-Shirt White/University Red,Nike,SIVVI,101.05,70.45,30.6,Boys,White/University Red,Cotton
Kids French Terry Shorts Blue,Nike,noon,150.0,105.0,45.0,Boys,Blue,Cotton
Indy Logo Sports Bra Grey,Nike,noon,199.0,139.0,60.0,Women,Grey,Polyester Blend
CrossFit Graphic T-shirt Grey,Reebok,noon,130.0,117.0,13.0,Men,Grey,Combination
Running  Activchill Graphic Vest White,Reebok,noon,190.0,95.0,95.0,Women,White,NA
Kids Must Haves Badge Of Sport Logo Print Tshirt Real Pink,adidas,noon,89.0,62.0,27.0,Girls,Real Pink,NA
adicolor 3 Stripe Shorts Grey,adidas Originals,Namshi,190.0,190.0,0.0,Men,Grey,Cotton
Must Haves Graphic Logo Print Tshirt White,adidas,noon,129.0,90.0,39.0,Women,White,Cotton
ID Lineage Tshirt Raw Khaki,adidas,noon,115.0,112.0,3.0,Men,Raw Khaki,NA
Casual Running Split Short Black,Reebok,noon,155.0,77.0,78.0,Men,Black,Polyester
Modern Sport Sweatpants Fig,PUMA,noon,210.0,84.0,126.0,Women,Fig,Combination
Run Just Do It T-Shirt Black/White,Nike,noon,120.0,96.0,24.0,Women,Black/White,NA
Ost Activchill Graphic T- Shirt Mineral Mist,Reebok,noon,194.0,183.0,11.0,Men,Mineral Mist,Polyamide
Power Run Fast Bra Puma Black Heather,PUMA,noon,235.0,185.3,49.7,Women,Puma Black Heather,Polyester
Gym Vintage Pant Black/University Red,Nike,noon,129.0,83.0,46.0,Men,Black/University Red,Cotton
Manchester City Stadium Home Jersey Field Blue,Nike,noon,407.0,244.0,163.0,Men,Field Blue,NA
Gs Opp Mirror T- Shirt Twisted Berry,Reebok,noon,100.0,93.0,7.0,Women,Twisted Berry,Cotton
Swoosh Core T-Shirt Dk Grey Heather,Nike,noon,129.0,83.0,46.0,Men,Dk Grey Heather,Cotton
Miler Vest Lavender Mist/Reflective Silver,Nike,noon,129.0,96.0,33.0,Women,Lavender Mist/Reflective Silver,NA
Pro Training Leggings Black,Nike,Namshi,219.0,219.0,0.0,Women,Black,Combination
Breathe Rise 365 T-Shirt Desert Sand/Htr/Mink Brown,Nike,noon,229.0,225.0,4.0,Men,Desert Sand/Htr/Mink Brown,Polyester
Futura Icon Vest White/Black,Nike,noon,130.0,97.0,33.0,Men,White/Black,NA
Kids Performance Cushioned No Show Songs 3 pk Black,Nike,noon,60.0,51.0,9.0,Kids Unisex,Black,73% Cotton; 23% Nylon; 3% Spandex; 1% Polyester
Ac Blocking Leggings Black,Reebok,noon,252.0,126.0,126.0,Women,Black,Polyester
Athletics Pack Graphic Tshirt Black,adidas,noon,155.0,100.0,55.0,Men,Black,Cotton
4KRFT Sport Badge Of Sport Shorts Black,adidas,noon,169.0,126.0,43.0,Men,Black,Polyester Blend
Saudi Arabia Stadium Home Jersey White,Nike,noon,425.0,233.0,192.0,Men,White,Polyester
3 Stripe Shorts Orange,adidas Originals,noon,139.0,83.0,56.0,Women,Orange,Polyester
2In1 Distance Shorts Signal Blue,Nike,noon,234.0,163.0,71.0,Men,Signal Blue,Polyester
Must Haves Graphic Logo Print Tshirt White,adidas,noon,115.0,80.0,35.0,Women,White,Cotton
Must Have 3 Stripe T-Shirt Blue,adidas,Namshi,135.0,135.0,0.0,Men,Blue,Cotton
The Rock Cropped Tshirt Grey,UNDER ARMOUR,Namshi,149.0,104.0,45.0,Women,Grey,Combination
Must Have Badge Of Sport Tshirt White,adidas,Namshi,115.0,115.0,0.0,Women,White,Polyester
City Sleek Vest Black,Nike,noon,199.0,139.0,60.0,Women,Black,NA
Dri-Fit Tapered Fleece Camo Sweatpants Black/Smoke Grey/White,Nike,noon,229.0,217.0,12.0,Men,Black/Smoke Grey/White,Polyester
One Team Jersey On Black,adidas,noon,139.0,139.0,0.0,Men,Black,Polyester
Design 2 Move Solid Tshirt Orange,adidas,Namshi,115.0,115.0,0.0,Women,Orange,Polyester
Taped Fleece Sweatpants Red,umbro,Namshi,145.0,145.0,0.0,Men,Red,Polyester
HD Wordmark T-Shirt White,UNDER ARMOUR,noon,129.0,120.0,9.0,Men,White,NA
Just Do It Vest Black,Nike,noon,129.0,96.0,33.0,Men,Black,NA
ID Photo Jersey Tshirt White,adidas,noon,140.0,98.0,42.0,Men,White,NA
Armour Fleece Hoodie Black,UNDER ARMOUR,Namshi,329.0,329.0,0.0,Men,Black,Fabric
FCB Ever Tagline Football T-Shirt Burgundy,Nike,SIVVI,131.7,91.9,39.8,Men,Burgundy,Cotton
Stunning Classic Pad Bra Pink,Nike,noon,179.0,125.0,54.0,Women,Pink,Combination
Nsw Club Jersey Jogger Grey,Nike,noon,169.0,143.0,26.0,Men,Grey,Cotton
Sport ID Logo Print Tshirt White,adidas,noon,139.0,97.0,42.0,Women,White,Cotton
Alphaskin Sport Shorts Black,adidas,Namshi,149.0,149.0,0.0,Men,Black,Combination
Run Essentials Graphic T-Shirt White,Reebok,noon,150.0,135.0,15.0,Men,White,NA
FC Barcelona T-shirt Blue,Nike,Namshi,219.0,219.0,0.0,Men,Blue,Polyester
NSW Just Do It Swoosh T-Shirt Navy,Nike,noon,129.0,103.0,26.0,Men,Navy,NA
Heritage Sweatpants Black/White/White,Nike,noon,249.0,186.0,63.0,Women,Black/White/White,Polyester
Graphic Short Sleeve Tshirt Blue/Yellow,Timberland,noon,100.0,75.0,25.0,Men,Blue/Yellow,NA
Must Have Badge Of Sport Vest Black/White,adidas,noon,115.0,80.0,35.0,Men,Black/White,Cotton
Short Sleeve Bodega Poster T-Shirt White,adidas Originals,SIVVI,137.85,97.0,40.85,Men,White,Combination
Always On Graphic Leggings Fig-Magenta Haze,PUMA,noon,260.0,104.0,156.0,Women,Fig-Magenta Haze,Combination
7/8 Air Mesh Running Leggings Purple,Nike,noon,269.0,201.0,68.0,Women,Purple,Nylon Blend
Bethe Strappy Vest Black/White,Nike,noon,132.0,85.0,47.0,Women,Black/White,Polyester
Design2Move Climacool Logo Tee Black,adidas,noon,115.0,80.0,35.0,Men,Black,Polyester Blend
Dry Hoop JDI Basketball T-Shirt Black/University Red,Nike,SIVVI,131.7,91.9,39.8,Men,Black/University Red,Cotton Blend
Badge of Sport Leggings Black,adidas,Namshi,165.0,165.0,0.0,Women,Black,Combination
Own the Run Summer Tshirt Pink,adidas,noon,169.0,109.0,60.0,Women,Pink,Polyester Blend
Phenom Air Elite Sweatpants Black/White/Reflective Silver,Nike,noon,405.0,283.0,122.0,Men,Black/White/Reflective Silver,Polyester
Kids JUVE Home Football Jersey Multicolour,adidas,Namshi,299.0,299.0,0.0,Men,Multicolour,Polyester
Climacool Workout Sweatpants Navy Blue,adidas,noon,305.0,213.0,92.0,Men,Navy Blue,Polyester
ID Glam Leggings Black,adidas,noon,215.0,150.0,65.0,Women,Black,Cotton Blend
Activchill T-Shirt White,Reebok,noon,205.0,194.0,11.0,Men,White,NA
Explosive Heather Tights Puma Black Heather,PUMA,noon,305.0,240.5,64.5,Women,Puma Black Heather,Combination
Tape Leggings Black,adidas Originals,noon,169.0,118.0,51.0,Women,Black,Cotton Blend
Tricolore Football T-shirt Grey,le coq sportif,noon,200.0,110.0,90.0,Men,Grey,Cotton
Elements Classic T-Shirt Grey,Reebok,Namshi,100.0,70.0,30.0,Men,Grey,Combination
Nsw Heritage Mesh T-Shirt White,Nike,Namshi,149.0,149.0,0.0,Women,White,Polyester
Classics Big Logo Print T-Shirt Grey,Reebok,noon,150.0,75.0,75.0,Men,Grey,NA
Daily Press T-Shirt Black,adidas,Namshi,165.0,165.0,0.0,Men,Black,Polyester
Work In Progress Floral Logo Hoodie Grey,adidas,Namshi,225.0,158.0,67.0,Women,Grey,Polyester
Chuck Taylor Baseball Cap Black,CONVERSE,Namshi,104.0,99.0,5.0,Men,Black,Cotton
Pro Hijab Navy Blue,Nike,Namshi,105.0,65.0,40.0,Women,Navy Blue,Combination
Chicago Bulls Club Fleece Hoodie red,Nike,Namshi,329.0,329.0,0.0,Men,red,Fabric
Wor Ac Graphic Ss T- Shirt Black,Reebok,noon,158.0,145.0,13.0,Men,Black,Polyamide
Leg-A-See Just Do It Leggings Dark Grey Heather/Black,Nike,noon,169.0,126.0,43.0,Women,Dark Grey Heather/Black,Combination
Elite Pro Training Tapered Pant Black,umbro,noon,247.0,49.0,198.0,Men,Black,Polyester
Logo Tape Popper Trackpant Black/White,Nike,noon,299.0,209.0,90.0,Women,Black/White,Combination
Run Essential T-Shirt Crushed Cobalt,Reebok,noon,150.0,135.0,15.0,Men,Crushed Cobalt,NA
ID Lineage Graphic Tshirt Black,adidas,noon,115.0,74.0,41.0,Men,Black,NA
Juventus Home Shorts White,adidas,noon,179.0,98.0,81.0,Men,White,Polyester
Must Have Badge Of Sports Tshirt Black,adidas,Namshi,165.0,115.0,50.0,Men,Black,Polyester
All Me Badge Of Sport Bra White,adidas,noon,129.0,90.0,39.0,Women,White,Polyester Blend
Kids FC Barcelona 3rd Jersey Lt Atomic Pink,Nike,noon,336.0,218.0,118.0,Boys,Lt Atomic Pink,Polyester
Toolkit Skateboarding Tshirt Black,adidas,noon,155.0,155.0,0.0,Men,Black,Cotton
Dri-FIT Training Vest Grey,Nike,noon,149.0,104.0,45.0,Women,Grey,Polyester
Yoga Lux Bold High Rise Tights Crushed Cobalt,Reebok,noon,247.0,135.0,112.0,Women,Crushed Cobalt,Combination
Run Stripe Woven Sweatpants Dk Smoke Grey / Reflective Silver,Nike,noon,205.0,143.0,62.0,Men,Dk Smoke Grey / Reflective Silver,Polyester
Favorite Graphic Tights Blue,UNDER ARMOUR,noon,150.0,97.0,53.0,Women,Blue,"58% Cotton,32% Polyester,10% Elastane"
City Sleek T-Shirt Black/Thunder Grey/Reflective Silv,Nike,noon,229.0,160.0,69.0,Women,Black/Thunder Grey/Reflective Silv,NA
Rival Fleece Sweatpants Black,UNDER ARMOUR,Namshi,199.0,199.0,0.0,Women,Black,Polyester
Classic Vector T-shirt Black,Reebok,noon,165.0,149.0,16.0,Men,Black,Cotton
Don't Rest Alphaskin Badge Of Sport Bra Maroon,adidas,noon,179.0,116.0,63.0,Women,Maroon,Polyester Blend
Must Have Badge Of Sport Sweatshirt Black,adidas,Namshi,249.0,249.0,0.0,Men,Black,Polyester
Sport ID T-Shirt Black/White,adidas,noon,115.0,80.0,35.0,Men,Black/White,NA
Own The Run Reflective Vest Pink,adidas,noon,139.0,97.0,42.0,Women,Pink,Polyester
Dri-FIT Camo T-Shirt Light Bone,Nike,noon,149.0,111.0,38.0,Men,Light Bone,NA
Rise 365 Running T-Shirt Atmosphere Grey/Htr/Reflective Silv,Nike,noon,205.0,143.0,62.0,Men,Atmosphere Grey/Htr/Reflective Silv,NA
Te Trend T- Shirt Chalk Green S18-R,Reebok,noon,158.0,145.0,13.0,Men,Chalk Green S18-R,Cotton
Mk1 Warmup Hoodie Black,UNDER ARMOUR,Namshi,289.0,289.0,0.0,Men,Black,Fabric
Trefoil Cut-Out Sweatshirt Black,adidas Originals,Namshi,325.0,325.0,0.0,Women,Black,Polyester
Essential 3 Stripe T-Shirt Blue,adidas,Namshi,125.0,125.0,0.0,Men,Blue,Cotton
ID Winners Muscle Tshirt Pink,adidas,noon,139.0,90.0,49.0,Women,Pink,Cotton Blend
Kids Real Madrid Home Replica Jersey Core White/Black,adidas,noon,305.0,167.0,138.0,Boys,Core White/Black,NA
SSG Zip Through Hoodie Blue,umbro,noon,310.0,46.0,264.0,Men,Blue,NA
Just Do It Swoosh Short Sleeves T-Shirt Black/White,Nike,noon,130.0,104.0,26.0,Men,NA,Cotton
Drive Time Tshirt White,VANS,noon,149.0,146.0,3.0,Women,White,Cotton
Classic Leggings Black,PUMA,noon,370.0,370.0,0.0,Women,Black,Polyester Blend
Dri-FIT Lux Embossed Sweatshirt Lavender Mist/White,Nike,noon,299.0,239.0,60.0,Women,Lavender Mist/White,Polyester
Kids Manchester United Jersey White,adidas,noon,395.0,294.0,101.0,Boys,White,Polyester
Infant 3-Piece Jordan Crew Socks Multicolor,Nike,Namshi,49.0,49.0,0.0,Kids Unisex,Multicolor,Polyester
Classics Vector T-Shirt White,Reebok,noon,165.0,165.0,0.0,Men,White,Cotton
High Neck Full Sleeve Track T-Shirt Black,adidas,Namshi,325.0,325.0,0.0,Men,Black,Polyester
Classic Callout Graphic T-shirt Navy,Reebok,noon,165.0,158.0,7.0,Men,Navy,Cotton
Rise Up N Run Tank Top Hi-Res Coral,adidas,noon,179.0,125.0,54.0,Women,Hi-Res Coral,NA
Just Do It Hooded Jacket Black,Nike,Namshi,329.0,329.0,0.0,Men,Black,Fabric
Lux Bold High Rise Leggings Blue Lagoon S18-R,Reebok,noon,310.0,124.0,186.0,Women,Blue Lagoon S18-R,Polyester Blend
Must Have Emblem T-Shirt White,adidas,noon,115.0,86.0,29.0,Men,White,NA
Hero Racer Brand Read Bra White,Reebok,noon,190.0,95.0,95.0,Women,White,NA
Casual Reflective T-Shirt White,Reebok,noon,205.0,191.0,14.0,Men,White,NA
Workout Ready Supremium Graphic T-Shirt Cranberry Red,Reebok,noon,120.0,108.0,12.0,Men,Cranberry Red,NA
Parley Tennis Vest Blue Spirit/White,adidas,noon,245.0,159.0,86.0,Women,Blue Spirit/White,NA
Crossfit Move T-Shirt White Melange,Reebok,noon,185.0,167.0,18.0,Men,White Melange,NA
Pure Vest Guava Ice,Nike,noon,152.0,91.0,61.0,Women,Guava Ice,NA
Prime Tshirt Orange,adidas,Namshi,99.0,99.0,0.0,Women,Orange,Polyester
Rise Up N Run Parley Tshirt Black,adidas,noon,195.0,195.0,0.0,Women,Black,Polyester
Wor Activchill Tech T- Shirt Bunker Blue,Reebok,noon,158.0,145.0,13.0,Men,Bunker Blue,Polyamide
Outline Trefoil Tshirt White,adidas Originals,Namshi,135.0,135.0,0.0,Men,White,Cotton
Elements Trend T-Shirt Green,Reebok,noon,155.0,77.0,78.0,Men,Green,NA
3-Stripe Sweatpants Blue,adidas,Namshi,199.0,199.0,0.0,Women,Blue,Polyester
Workout Ready Leggings Black,Reebok,Namshi,150.0,150.0,0.0,Women,Black,Combination
Hypercool Three Quarter Leggings Olive Canvas,Nike,noon,225.0,135.0,90.0,Men,Olive Canvas,Combination
PSG Nsw Core Polo T-Shirt Black,Nike,noon,199.0,159.0,40.0,Men,Black,Cotton
Dri-FIT Miler Running T-Shirt Dk Grey Heather,Nike,noon,150.0,105.0,45.0,Men,Dk Grey Heather,Cotton
Kids Arsenal Jersey Red,PUMA,noon,395.0,294.0,101.0,Boys,Red,Polyester
Kids Jordan Speckle T-Shirt Prints,Nike,Namshi,79.0,79.0,0.0,Boys,Prints,Cotton
4KRFT Winterized Embossed Shorts Black/Grey Three,adidas,noon,169.0,118.0,51.0,Men,Black/Grey Three,Polyester
Running Short Sleeve Elevated Tshirt Carotene,Reebok,noon,205.0,123.0,82.0,Men,Carotene,Polyester
Kids Sportswear Club Fleece Sweatpants Dark Grey Heather,Nike,noon,249.0,186.0,63.0,Boys,Dark Grey Heather,Cotton Blend
All Over Mesh T-Shirt Black/Black/(White),Nike,noon,149.0,146.0,3.0,Women,Black/Black/(White),Cotton
Gym Vintage Shorts Grey/White,Nike,noon,150.0,97.0,53.0,Women,Grey/White,Combination
Tech Novelty Boxers 2pk Black,UNDER ARMOUR,noon,169.0,118.0,51.0,Men,Black,Polyester
Training Essential Twill Sweatshirt Pink,Reebok,Namshi,235.0,235.0,0.0,Women,Pink,Cotton
Alphaskin Badge Of Sport Leggings Maroon,adidas,noon,215.0,139.0,76.0,Women,Maroon,Polyester Blend
ID Graphic Printed Sweatpants Navy,adidas,Namshi,275.0,193.0,82.0,Men,Navy,Polyester
Short Sleeves T-shirt White/Grey,UNDER ARMOUR,noon,129.0,96.0,33.0,Men,White/Grey,NA
Classics T-Shirt Black,Reebok,Namshi,140.0,140.0,0.0,Women,Black,Cotton
Must Haves Plain Tshirt White,adidas,noon,115.0,74.0,41.0,Men,White,Cotton
Real Madrid T-Shirt Black,adidas,noon,155.0,108.0,47.0,Men,Black,Cotton Blend
Eclipse 2-In-1 Shorts Black,Nike,noon,234.0,152.0,82.0,Women,Black,Polyester
I See You Badge Of Sport T-Shirt Glow Blue,adidas,noon,115.0,80.0,35.0,Women,Glow Blue,NA
Heather Cat T-Shirt Dark Green,PUMA,noon,140.0,91.0,49.0,Women,Dark Green,Polyester
Essential Linear Sweatshirt Grey,adidas,Namshi,199.0,199.0,0.0,Women,Grey,Polyester
