name,brand,sold_by,old_price,current_price,saving,section,color,material
Design 2 Move 3 Stripes Tshirt Maroon,adidas,noon,129.0,96.0,33.0,Men,Maroon,Polyester Blend
Badge Of Sport Shaped Hem Vest White,adidas,noon,155.0,155.0,0.0,Women,White,Polyester
Cotton Sport Id Hoodie Black,adidas,Namshi,299.0,299.0,0.0,Men,Black,Cotton
Cl F Pocket T- Shirt Black,Reebok,noon,173.0,166.0,7.0,Men,Black,Cotton
Adicolor 3 Stripe Leggings Black,adidas Originals,Namshi,135.0,135.0,0.0,Women,Black,Combination
Logo Tape Sweatpants Black/White,Nike,noon,305.0,213.0,92.0,Women,Black/White,Polyester
Ss Elev T- Shirt White,Reebok,noon,215.0,198.0,17.0,Men,White,Polyester
Dri-FIT Miler Running T-Shirt Black/Reflective Silver,Nike,noon,170.0,119.0,51.0,Men,Black/Reflective Silver,Polyester
Gym Vintage Sweatpants Celestial Teal/Sail,Nike,noon,229.0,125.0,104.0,Women,Celestial Teal/Sail,Cotton
2-Piece Trefoil Set Pink/White,adidas Originals,Namshi,165.0,165.0,0.0,Kids Unisex,Pink/White,Cotton
Mk1 Wordmark Sweatshirt Blue,UNDER ARMOUR,Namshi,199.0,199.0,0.0,Men,Blue,Fabric
Modern Sports Advanced T-Shirt Black,PUMA,Namshi,115.0,115.0,0.0,Men,Black,Cotton
Tape Bra Bold Green,adidas Originals,noon,139.0,97.0,42.0,Women,Bold Green,NA
Nsw Jdi Crew Fleece Bstr Sweatshirt Charcoal Heathr,Nike,SIVVI,305.3,213.4,91.9,Men,Charcoal Heathr,Cotton Blend
Logo T-Shirt Black,umbro,Namshi,65.0,65.0,0.0,Men,Black,Cotton
Response Soft Running Tshirt Grey,adidas,noon,170.0,164.0,6.0,Men,Grey,Combination
Infant Animal Set Multicolor,adidas,Namshi,150.0,105.0,45.0,Girls,Multicolor,Cotton
Hangtag Swoosh T-Shirt White,Nike,noon,172.0,168.0,4.0,Men,White,Polyester
Kids Colorblock Logo T-Shirt Blue Void/University Red/White/White,Nike,noon,129.0,96.0,33.0,Boys,Blue Void/University Red/White/White,NA
Miler T-Shirt Grey Heather/(White),Nike,noon,329.0,323.0,6.0,Women,Grey Heather/(White),Cotton
Grey Melange NSW JDI 3 SS T-Shirt Dk Grey Heather,Nike,SIVVI,131.7,91.9,39.8,Men,Dk Grey Heather,Combination
No Club Tshirt Black,VANS,noon,119.0,117.0,2.0,Women,Black,Cotton
Fast Left Chest Graphic Tshirt Black/Pitch Gray/White,UNDER ARMOUR,noon,129.0,103.0,26.0,Men,Black/Pitch Gray/White,Cotton Blend
Cl V P Joggers Black,Reebok,noon,294.0,147.0,147.0,Women,Black,Cotton
Air Challenger 7in Shorts Grey,Nike,noon,149.0,111.0,38.0,Men,Grey,Polyester
Elevated Running T-Shirt Red,Reebok,noon,205.0,185.0,20.0,Men,Red,NA
Atletics Pack Graphic Hoodie Black,adidas,Namshi,349.0,349.0,0.0,Men,Black,Polyester
PSG Modern Polo Red,Nike,noon,199.0,149.0,50.0,Men,Red,Cotton
Badge Of Sport Logo Print Tshirt Black,adidas,Namshi,115.0,115.0,0.0,Women,Black,Combination
Chill Sleeveless Tank Clear Mint,adidas,noon,205.0,112.0,93.0,Women,Clear Mint,NA
Graphic Series Strong T-Shirt Black,Reebok,Namshi,95.0,95.0,0.0,Men,Black,Cotton
Tango Jacquard Shorts White,adidas,noon,169.0,109.0,60.0,Men,White,Polyester Blend
Wor Wv Graphic Shorts Bunker Blue,Reebok,noon,158.0,94.0,64.0,Men,Bunker Blue,Fabric
FC Bayern Third Jersey Raw Steel/Utility Blue/White,adidas,noon,400.0,240.0,160.0,Men,Raw Steel/Utility Blue/White,100% recycled polyester doubleknit
Sport Id Sweatpants Grey,adidas,Namshi,249.0,249.0,0.0,Men,Grey,Cotton
Workout Ready Solid T-Shirt Blue,Reebok,noon,120.0,78.0,42.0,Women,Blue,Cotton
Must Haves Plain Tshirt Grey,adidas,noon,115.0,80.0,35.0,Men,Grey,Cotton
Graphic Print Tshirt Black,adidas,noon,115.0,112.0,3.0,Women,Black,Cotton
3 Stripe T-Shirt Black,adidas Originals,Namshi,239.0,239.0,0.0,Women,Black,Polyester
Kids HeatGear Leggings Refresh Mint,UNDER ARMOUR,noon,160.0,80.0,80.0,Girls,Refresh Mint,Polyester
Pro Intertwist Crossover Shorts Black/White,Nike,noon,173.0,103.0,70.0,Women,Black/White,Combination
SST Track Jacket Blue,adidas Originals,noon,329.0,230.0,99.0,Women,Blue,Cotton
Trendy Compression Cycling Shorts Black,SKECHERS,noon,205.0,153.75,51.25,Women,Black,Combination
Tape Crop Top Blue,adidas Originals,noon,169.0,118.0,51.0,Women,Blue,Cotton
Juventus DNA Graphic Tshirt Black,adidas,Namshi,135.0,135.0,0.0,Men,Black,Cotton
Essential Linear Sweatshirt Black,adidas,Namshi,200.0,200.0,0.0,Women,Black,Combination
Kids All Caps Crew Neck Tshirt Flash Orange,adidas,noon,115.0,80.0,35.0,Boys,Flash Orange,Polyester Blend
Dry Transcend T-Shirt Pacific Blue/Psychic Blue,Nike,noon,205.0,143.0,62.0,Men,Pacific Blue/Psychic Blue,NA
Training Essentials Marble Sweatpant Black,Reebok,Namshi,255.0,255.0,0.0,Men,Black,Polyester
Must Haves Emblem Tshirt Collegiate Royal,adidas,noon,129.0,90.0,39.0,Men,Collegiate Royal,Cotton
Classics Vector T-Shirt Black/Toxic Yellow,Reebok,noon,165.0,107.0,58.0,Men,Black/Toxic Yellow,Cotton
Kids Dri-Fit Neymar T-Shirt Laser Crimson/Black/White,Nike,noon,129.0,96.0,33.0,Boys,Laser Crimson/Black/White,Polyester
Inverse Box Logo T-Shirt Purple,UNDER ARMOUR,noon,129.0,90.0,39.0,Men,Purple,Cotton Blend
10K Breathe Vest Black,Nike,noon,129.0,90.0,39.0,Women,Black,NA
Short Sleeve Solid Tshirt Raw White,adidas,noon,170.0,164.0,6.0,Men,Raw White,Cotton
Must Have Kangaroo Pocket Sport Hoodie Blue,adidas,noon,279.0,209.0,70.0,Men,Blue,Cotton Blend
4KRFT Sport Badge of Sport Shorts Blue,adidas,noon,169.0,118.0,51.0,Men,Blue,Polyester Blend
Must Haves Badge Of Sport Fleece Pullover Medium Grey Heather,adidas,noon,279.0,195.0,84.0,Men,Medium Grey Heather,Cotton Blend
Modern Muscle Vest Echo Pink/Pink Quartz,Nike,noon,129.0,90.0,39.0,Women,Echo Pink/Pink Quartz,Polyester Blend
ID Mesh T-Shirt Maroon,adidas,noon,169.0,169.0,0.0,Women,Maroon,Polyester Blend
Black NSW Air SS Top Black,Nike,SIVVI,172.55,120.45,52.1,Women,Black,Cotton
Elements Tracksuit Monochrome,Reebok,Namshi,255.0,255.0,0.0,Women,Monochrome,Polyester
Peraza Tshirt White,VANS,noon,139.0,97.0,42.0,Men,White,Cotton
Essentials Linear Tshirt Burgundy,adidas,Namshi,99.0,99.0,0.0,Women,Burgundy,Cotton
Pure Dolphin Hemmed Skirt Blue Void/White,Nike,noon,183.0,109.0,74.0,Women,Blue Void/White,NA
Monogram All Over Print Jersey Black,adidas Originals,noon,169.0,169.0,0.0,Men,Black,Polyester Blend
ID Stadium Shorts Stadium Heather,adidas,noon,135.0,81.0,54.0,Boys,Stadium Heather,Combination
Miler Tech Running T-Shirt Obsidian/Htr/Obsidian/Reflective Silv,Nike,noon,170.0,136.0,34.0,Men,Obsidian/Htr/Obsidian/Reflective Silv,Polyester
Must Haves Badge Of Sport Sleeveless Vest White,adidas,Namshi,115.0,115.0,0.0,Men,White,Cotton
Trefoil Logo Print Tshirt White,adidas,noon,155.0,108.0,47.0,Men,White,Cotton
2 In 1 Shorts Island Paradise-Aquarius,PUMA,noon,225.0,101.0,124.0,Women,Island Paradise-Aquarius,Nylon
Z.N.E. Reversible Leggings Pink,adidas,Namshi,240.0,156.0,84.0,Women,Pink,Combination
Packallover Kangaroo Pocket Hoodie Multicolour,adidas,Namshi,349.0,244.0,105.0,Men,Multicolour,Polyester
Purple NSW Air HZ Sweatshirt Sanded Purple,Nike,SIVVI,356.35,249.15,107.2,Women,Sanded Purple,Cotton Blend
Ruched Cropped Tshirt Black,adidas Originals,Namshi,165.0,165.0,0.0,Women,Black,NA
Spain Home Jersey Red/Yellow,adidas,Namshi,195.0,117.0,78.0,Men,Red/Yellow,Combination
Essential 3 Stripe T-Shirt Black,adidas,Namshi,275.0,275.0,0.0,Men,Black,Polyester
Training Essential Marble Logo T-Shirt Purple,Reebok,noon,100.0,90.0,10.0,Women,Purple,NA
Fc Barcelona Stadium Home Jersey T-Shirt T-Shirt Blue/Red,Nike,Namshi,449.0,449.0,0.0,Men,Blue/Red,Polyester
Own the Run Tshirt Black,adidas,noon,169.0,109.0,60.0,Women,Black,Polyester Blend
Te Marble Group Shorts Bunker Blue,Reebok,noon,158.0,94.0,64.0,Men,Bunker Blue,Cotton
Youth Training Sweatpants Carbon/Black,adidas,noon,300.0,180.0,120.0,Boys,Carbon/Black,Combination
Classics Vector T-Shirt Grey/Black,Reebok,noon,165.0,107.0,58.0,Men,Grey/Black,Cotton
Meet You There Joggers Black,Reebok,noon,255.0,178.0,77.0,Men,Black,Polyamide
Tom Brady Seamless Spacedye Tshirt Grey,UNDER ARMOUR,noon,160.0,88.0,72.0,Women,Grey,Combination
Flex Jacket Multicolour,Nike,Namshi,299.0,299.0,0.0,Men,Multicolour,Nylon
Curl Sports Bra White,PUMA,noon,190.0,95.0,95.0,Women,White,Polyester Blend
Casual Sweatpants Black,PUMA,noon,230.0,230.0,0.0,Boys,Black,Cotton Blend
CFC Core Polo Rush Blue/White,Nike,noon,205.0,143.0,62.0,Men,Rush Blue/White,Cotton
Must Haves Foil Print Tshirt Active Maroon,adidas,noon,129.0,83.0,46.0,Women,Active Maroon,Cotton
Sportstyle T-Shirt Black,UNDER ARMOUR,Namshi,189.0,132.0,57.0,Men,Black,Combination
Badge Of Sport Shaped Hem Vest Glow Pink,adidas,noon,155.0,155.0,0.0,Women,Glow Pink,Polyester
Graphic Series No To No T-Shirt Crushed Cobalt,Reebok,noon,120.0,108.0,12.0,Men,Crushed Cobalt,NA
Classics Hoodie Black,Reebok,Namshi,290.0,290.0,0.0,Men,Black,Polyester
SST Track Jacket Orange,adidas Originals,noon,329.0,230.0,99.0,Women,Orange,NA
Logo T-Shirt Navy,umbro,Namshi,65.0,65.0,0.0,Men,Navy,Cotton
Dubai City Tshirt White,VANS,noon,99.0,69.0,30.0,Men,White,Combination
Printed Sleeveless Tank Top Black,adidas,Namshi,189.0,189.0,0.0,Women,Black,Cotton
ID 3 Stripes Jersey Tshirt,adidas,noon,169.0,76.0,93.0,Men,NA,Cotton
Must Haves Flower Tshirt White,adidas,noon,129.0,90.0,39.0,Women,White,Cotton
ID Leggings Black,adidas,noon,195.0,136.0,59.0,Women,Black,Cotton Blend
Training Essential Twill Sweatpants Grey,Reebok,Namshi,205.0,205.0,0.0,Women,Grey,Cotton
Nsw T-Shirt Navy,Nike,Namshi,129.0,129.0,0.0,Men,Navy,Cotton
Athletics Pack Long Sleeves Tshirt Black,adidas,noon,205.0,112.0,93.0,Men,Black,Cotton
Classics Vector Light-Impact Bra Black,Reebok,noon,185.0,111.0,74.0,Women,Black,Polyester Blend
NSW T-Shirt Black,Nike,Namshi,149.0,149.0,0.0,Men,Black,Cotton
Dri-Fit Seasonal Allover Print T-Shirt Battle Blue,Nike,noon,149.0,111.0,38.0,Men,Battle Blue,Polyester
3 Stripe Tshirt Pink,adidas,Namshi,149.0,149.0,0.0,Women,Pink,Polyester
Breathe Short Sleeve Hyper Dry T-Shirt Beige,Nike,noon,159.0,156.0,3.0,Women,Beige,Polyester
Logo Print Classic T-Shirt Soft Fluo Peach,PUMA,noon,184.0,180.0,4.0,Women,Soft Fluo Peach,Polyester
R.Y.V Logo Print Tshirt Black,adidas Originals,Namshi,135.0,135.0,0.0,Men,Black,Cotton
Short Sleeve Essentiels T-shirt Blue,le coq sportif,noon,195.0,107.0,88.0,Men,Blue,Cotton
Round Neck Short Sleeves T-Shirt Black,adidas,Namshi,189.0,189.0,0.0,Women,Black,Cotton
Borg Striped Polo Yellow,FILA,Namshi,205.0,205.0,0.0,Men,Yellow,Cotton
Speedwick Graphic T-Shirt Black,Reebok,noon,150.0,135.0,15.0,Men,Black,NA
Khabib T-Shirt Black,Reebok,Namshi,125.0,125.0,0.0,Men,Black,Cotton
Techknit Ultra T-Shirt Volt/White/Reflective Silver,Nike,noon,275.0,206.0,69.0,Men,Volt/White/Reflective Silver,Polyester
Essential Running Hijab Black,adidas,noon,99.0,69.0,30.0,Women,Black,Nylon Blend
Basic Leggings Black,adidas Originals,noon,139.0,104.0,35.0,Women,Black,Cotton Blend
Striped Sweatpants Black,adidas Originals,Namshi,325.0,325.0,0.0,Men,Black,Cotton
Heat Gear Yoga Leggings Black,UNDER ARMOUR,Namshi,189.0,189.0,0.0,Women,Black,87% Polyester 13% Elastane
Grid Logo T-Shirt Teal Vibe/Black,UNDER ARMOUR,noon,129.0,96.0,33.0,Men,Teal Vibe/Black,Cotton Blend
Mascot Jersey Tshirt,adidas,noon,115.0,86.0,29.0,Men,NA,Cotton
Rebel Bold T-Shirt White,PUMA,Namshi,110.0,110.0,0.0,Men,White,Cotton
Less Mills Mesh Base Ball Tank Blue Slate,Reebok,noon,210.0,105.0,105.0,Men,Blue Slate,NA
Arsenal FC Sweatpants Collegiate Navy/Scarlet,adidas,noon,195.0,136.0,59.0,Boys,Collegiate Navy/Scarlet,Cotton Blend
Swoosh T-Shirt Multicolour,Nike,Namshi,149.0,149.0,0.0,Men,Multicolour,Cotton
Dri-Fit Running T-Shirt Black/White,Nike,SIVVI,129.0,91.9,37.1,Men,Black/White,NA
Classics Sweatshirt Navy,Reebok,Namshi,290.0,290.0,0.0,Men,Navy,Cotton
CFC Core Polo White/Rush Blue,Nike,noon,205.0,143.0,62.0,Men,White/Rush Blue,Cotton
Superstar Sweatpants Red,adidas Originals,Namshi,275.0,275.0,0.0,Women,Red,Polyester
Reflective Tee Grey,Reebok,noon,205.0,194.0,11.0,Men,Grey,NA
Training Speedwick Move T-shirt White,Reebok,noon,150.0,143.0,7.0,Men,White,Combination
Combat Wordmark T-Shirt Black,Reebok,noon,150.0,135.0,15.0,Men,Black,NA
Juventus Striped Sweatpants Black,adidas,Namshi,249.0,249.0,0.0,Men,Black,Polyester
Virat Kohli Knitted Shorts Black,PUMA,Namshi,160.0,160.0,0.0,Men,Black,Polyester
Wor Ac Graphic Ss T- Shirt Carotene,Reebok,noon,158.0,148.0,10.0,Men,Carotene,Polyamide
Dri-FIT Side Tie T-Shirt Pink Quartz/Echo Pink,Nike,noon,129.0,103.0,26.0,Women,Pink Quartz/Echo Pink,Polyester Blend
Dry Taper Fleece Pants Cargo Khaki/Black,Nike,noon,205.0,164.0,41.0,Men,Cargo Khaki/Black,Polyester
Dry-Fit Classic Shorts Blue,Nike,Namshi,169.0,169.0,0.0,Men,Blue,Polyester
Sportswear Woven Sweatpants White,Nike,Namshi,299.0,194.0,105.0,Women,White,Polyester
Design 2 Move Cropped Tshirt Black/White,adidas,noon,115.0,80.0,35.0,Women,Black/White,NA
Dubai Graphic T-Shirt Black/Metallic Gold,UNDER ARMOUR,noon,149.0,139.0,10.0,Men,Black/Metallic Gold,NA
Kids Arsenal Jersey Brown,PUMA,noon,395.0,294.0,101.0,Boys,Brown,Polyester
Pro Long Sleeve T-Shirt White/Black,Nike,noon,185.0,129.0,56.0,Men,White/Black,Polyester
Workout Supremium 2.0 Vest Infused Lilac F18-R,Reebok,noon,100.0,50.4,49.6,Women,Infused Lilac F18-R,NA
Trefoil Logo Print Tshirt Black,adidas,noon,155.0,100.0,55.0,Men,Black,Cotton
Dri-Fit Elastika Vest Black/Black/White,Nike,noon,150.0,112.0,38.0,Women,Black/Black/White,NA
Short Sleeve Polo T-Shirt Blue,adidas,Namshi,165.0,165.0,0.0,Men,Blue,Polyester
Classic Taped Hoodie Black,Reebok,noon,340.0,238.0,102.0,Men,Black,Cotton
Graphic Series Training Supply T-Shirt Beige,Reebok,Namshi,100.0,100.0,0.0,Men,Beige,Cotton
Trefoil 3 Stripes Leggings Red,adidas Originals,noon,169.0,101.0,68.0,Women,Red,Cotton Blend
Qqr- Reebok Linear Read T- Shirt White/Chalk Green S18-R,Reebok,noon,100.0,40.0,60.0,Men,White/Chalk Green S18-R,Cotton
Victory Compression Training Sports Bra White/Black,Nike,noon,129.0,109.0,20.0,Women,White/Black,Polyester Blend
Striped Polo T-Shirt Yellow/White,Nike,Namshi,229.0,160.0,69.0,Men,Yellow/White,Cotton
Solid Colour Shorts Black,adidas,Namshi,115.0,115.0,0.0,Men,Black,Polyester
One Series Epic Knit Shorts Black,Reebok,Namshi,255.0,179.0,76.0,Men,Black,Combination
Less Mills Muscle Vest Dgh Solid Grey,Reebok,noon,185.0,111.0,74.0,Men,Dgh Solid Grey,Polyester
Adicolor 3 Striped Sweatpants Black,adidas Originals,Namshi,325.0,325.0,0.0,Men,Black,Combination
Cf Games Crest T- Shirt Black,Reebok,noon,137.0,128.0,9.0,Men,Black,Cotton
ID Graphic Tshirt White,adidas,noon,179.0,179.0,0.0,Men,White,Cotton
Classic Front Pocket T-shirt White,Reebok,noon,165.0,158.0,7.0,Men,White,Cotton
Just Do It Fleece Sweatpants Charcoal Heathr,Nike,noon,305.0,228.0,77.0,Men,Charcoal Heathr,Cotton Blend
ID Leggings Blue,adidas,noon,195.0,136.0,59.0,Women,Blue,Cotton Blend
Round Neck YB ID Varsity T-Shirt White,adidas,SIVVI,117.4,81.65,35.75,Boys,White,Combination
D2M 3 Stripes T-Shirt Black,adidas,noon,139.0,97.0,42.0,Men,Black,NA
Dri-Fit Training T-Shirt Dark Grey Heather/Black,Nike,noon,129.0,96.0,33.0,Men,Dark Grey Heather/Black,NA
Dry Cool Miler T-shirt Gunsmoke,Nike,noon,149.0,111.0,38.0,Men,Gunsmoke,NA
Graphic Jersey Tshirt White,adidas,noon,119.0,77.0,42.0,Men,White,Cotton
Graphic Series No To No T-Shirt White,Reebok,noon,120.0,108.0,12.0,Men,White,NA
Dry Miler T-Shirt Black/Reflective Silver,Nike,noon,169.0,126.0,43.0,Men,Black/Reflective Silver,NA
Ss Ac T- Shirt Twisted Berry F18-R,Reebok,noon,215.0,198.0,17.0,Women,Twisted Berry F18-R,Polyamide
Speedwick Tshirt Black,Reebok,noon,140.0,126.0,14.0,Men,Black,Polyester
Just Do It Crew Shorts Black/Reflective Silver,Nike,noon,173.0,103.0,70.0,Women,Black/Reflective Silver,Polyester
Amphi Hipster Bottoms Mystery Ink F17,adidas,noon,140.0,77.0,63.0,Women,Mystery Ink F17,NA
ID Winners V-Neck T-Shirt White,adidas,noon,139.0,139.0,0.0,Women,White,Cotton Blend
Farm AOP Dress Multicolour,adidas,Namshi,189.0,189.0,0.0,Women,Multicolour,Polyester
Logo Stripe Tshirt Flash Orange,adidas Originals,noon,139.0,104.0,35.0,Women,Flash Orange,NA
Believe This Wanderlust Leggings Glow Orange,adidas,noon,385.0,231.0,154.0,Women,Glow Orange,Polyester Blend
3-Stripe Sweatpants Grey,adidas,Namshi,209.0,146.0,63.0,Women,Grey,Polyester
Heat Gear Armour T-Shirt Black,UNDER ARMOUR,Namshi,159.0,159.0,0.0,Women,Black,Polyester
Badge Of Sport Logo Print Tshirt Black,adidas,noon,179.0,125.0,54.0,Women,Black,NA
Athletics Pack Graphic Tshirt White,adidas,noon,155.0,100.0,55.0,Men,White,Cotton
PSG Strike T-Shirt Black,Nike,noon,229.0,183.0,46.0,Men,Black,NA
Must Haves Badge Of Sport Logo Print Tshirt Red,adidas,noon,115.0,86.0,29.0,Men,Red,Cotton
Combat Spray Dye T-Shirt Flagre,Reebok,noon,185.0,167.0,18.0,Men,Flagre,NA
All-In Tights Pink,Nike,Namshi,189.0,189.0,0.0,Women,Pink,Polyester
Graphic T-Shirt Red,PUMA,Namshi,110.0,110.0,0.0,Men,Red,Cotton
Workout Supremium 2.0 Graphic T-Shirt Mineral Mist,Reebok,noon,120.0,108.0,12.0,Men,Mineral Mist,NA
Side Striped Tshirt Black,adidas Originals,Namshi,189.0,189.0,0.0,Men,Black,Cotton
Pro Breathe T-Shirt Black / Anthracite / Dark Grey,Nike,noon,225.0,157.0,68.0,Men,Black / Anthracite / Dark Grey,Polyester Blend
Essential Linear Logo Tshirt Black,adidas,Namshi,100.0,99.0,1.0,Men,Black,Cotton
FreeLift Graphic Tech Tshirt,adidas,noon,165.0,107.0,58.0,Men,NA,Cotton Blend
Kids Dri-Fit Neymar Pants Black/Laser Crimson/White,Nike,noon,199.0,149.0,50.0,Boys,Black/Laser Crimson/White,Polyester
Yoga Long Sleeve Cardigan Grey,Nike,noon,305.0,213.0,92.0,Women,Grey,Polyester Blend
Workout Ready Leggings Black,Reebok,Namshi,150.0,150.0,0.0,Women,Black,Polyester
X Marvel Tshirt Blue,VANS,noon,109.0,107.0,2.0,Men,Blue,Cotton
Pro Compression T-Shirt Carbon Heather/Black/Black,Nike,noon,170.0,127.0,43.0,Men,Carbon Heather/Black/Black,NA
Chelsea Crest T-Shirt Navy,Nike,Namshi,149.0,149.0,0.0,Men,Navy,Cotton
FreeLift Sport Ultimate Solid T-Shirt Black,adidas,noon,139.0,97.0,42.0,Men,Black,NA
Printed Shorts Black,UNDER ARMOUR,noon,214.0,117.0,97.0,Men,Black,Polyester
Kids Air Sweatpants Black/University Red/Team Gold/White,Nike,noon,255.0,178.0,77.0,Boys,Black/University Red/Team Gold/White,Cotton Blend
Youth Futura Femme AOP T-Shirt Black,Nike,Namshi,99.0,99.0,0.0,Kids Unisex,Black,Cotton
High Neck Full Sleeve Jacket Black,adidas,Namshi,325.0,227.0,98.0,Men,Black,Polyester
Rc Burnout Ss T- Shirt Bunker Blue F18-R,Reebok,noon,252.0,236.0,16.0,Men,Bunker Blue F18-R,Polyester
Must Haves Badge Of Sport Foil Tee Black,adidas,noon,129.0,90.0,39.0,Men,Black,Cotton
Classic Vector T-Shirt Yellow,Reebok,noon,165.0,115.0,50.0,Men,Yellow,Cotton
Element Logo Vest Celestial Orchid,Reebok,noon,100.0,90.0,10.0,Women,Celestial Orchid,NA
Don't Rest 3 Stripe Bra White,adidas,noon,129.0,90.0,39.0,Women,White,Polyester Blend
Paris Saint German Stadium Jersey Light Bone,Nike,noon,407.0,264.0,143.0,Men,Light Bone,NA
Jordan Jumpman Fleece Sweatpants Carbon Heather/Black,Nike,noon,369.0,295.0,74.0,Men,Carbon Heather/Black,Cotton Blend
NSW Heritage Mesh Sweatshirt White,Nike,Namshi,249.0,249.0,0.0,Women,White,Polyester
F Graphic T-Shirt Cranberry Red/White,Reebok,noon,140.0,126.0,14.0,Women,Cranberry Red/White,NA
HD Wordmark T-Shirt Black,UNDER ARMOUR,noon,129.0,120.0,9.0,Men,Black,NA
Must Haves Badge Of Sport Logo Print Tshirt White,adidas,Namshi,239.0,239.0,0.0,Women,White,Polyester
Flex Stride 5 Shorts Blue Void/Reflective Silver,Nike,noon,205.0,143.0,62.0,Men,Blue Void/Reflective Silver,Polyester
Kids Manchester United Home Jersey Red,adidas,noon,395.0,294.0,101.0,Boys,Red,Polyester
Ac Graphic Move T-Shirt White,Reebok,noon,185.0,167.0,18.0,Men,White,NA
Modern Muscle Vest Black,Nike,noon,129.0,90.0,39.0,Women,Black,Polyester Blend
Sportswear Club Fleece Dk Grey Heather/Matte Silver/White,Nike,noon,229.0,194.0,35.0,Men,Dk Grey Heather/Matte Silver/White,Cotton Blend
All Me Seamless Bra Black,adidas,Namshi,195.0,137.0,58.0,Women,Black,Combination
Advantage Crew Neck Tshirt White,adidas,noon,195.0,117.0,78.0,Women,White,Combination
Blush NSW Air HZ Sweatshirt Echo Pink,Nike,SIVVI,356.35,249.15,107.2,Women,Echo Pink,Cotton Blend
7/8 Printed Running Leggings Phantom/Reflective Silv,Nike,noon,269.0,188.0,81.0,Women,Phantom/Reflective Silv,Polyester Blend
Nsw Sport Charm T-Shirt Black,Nike,Namshi,149.0,149.0,0.0,Women,Black,Cotton
Real Madrid Adidas Training Tshirt Black,adidas,Namshi,149.0,149.0,0.0,Men,Black,Polyester
Believe This 3-Stripes Leggings Black,adidas,noon,329.0,197.0,132.0,Women,Black,Polyester Blend
Element Crew 3.0 T-Shirt Juniper Fog/Jade Horizon/Reflective Silver,Nike,noon,255.0,191.0,64.0,Men,Juniper Fog/Jade Horizon/Reflective Silver,NA
Nsw T-Shirt Blue,Nike,noon,129.0,103.0,26.0,Men,Blue,NA
Daily Press T-Shirt Black,adidas,Namshi,165.0,165.0,0.0,Men,Black,Polyester
Tango Jacquard Soccer Tshirt Black,adidas,noon,190.0,114.0,76.0,Men,Black,Combination
Breathe PSG Strike T-Shirt Red,Nike,noon,199.0,159.0,40.0,Kids Unisex,Red,NA
Tech 2.0 Sweatshirt Black,UNDER ARMOUR,Namshi,149.0,104.0,45.0,Men,Black,Polyester
Club Jersey Sweatpants Black,Nike,Namshi,169.0,169.0,0.0,Men,Black,Cotton
Dri-Fit Running T-Shirt White/Black,Nike,noon,129.0,96.0,33.0,Men,White/Black,NA
Celebrate The 90'S Sweatshirt White,adidas,Namshi,249.0,249.0,0.0,Men,White,Polyester
Must Haves French Terry Badge Of Sports Sweatpants Medium Grey Heather,adidas,noon,245.0,196.0,49.0,Men,Medium Grey Heather,Cotton Blend
Mk1 Terry Sweatpants Black,UNDER ARMOUR,Namshi,269.0,269.0,0.0,Men,Black,Combination
4KRFT Badge Of Sport Shorts Black,adidas,noon,169.0,109.0,60.0,Men,Black,Polyester Blend
Commercial Bomber Jacket Black,adidas,Namshi,249.0,249.0,0.0,Men,Black,Polyester
Breathe PSG Strike T-Shirt Black,Nike,noon,199.0,159.0,40.0,Kids Unisex,Black,NA
Mini Futura Air T-Shirt Mystic Red,Nike,noon,129.0,126.0,3.0,Men,Mystic Red,Cotton
Running Short Sleeves T-Shirt Carotene,Reebok,noon,139.0,69.0,70.0,Men,Carotene,NA
Rats Graphic Print Tshirt Grey,adidas,noon,155.0,155.0,0.0,Men,Grey,Cotton
Floral Allover Print Shorts Multicolour,adidas Originals,noon,169.0,101.0,68.0,Women,Multicolour,Polyester
Salah Celebration Tshirt White,adidas,noon,115.0,115.0,0.0,Men,White,Cotton
Logo Waist Tights Black,Nike,Namshi,199.0,199.0,0.0,Women,Black,Polyester
Pro 3/4 Tights Black,Nike,Namshi,179.0,179.0,0.0,Men,Black,Combination
Juventus Away Jersey Sesame/Clay,adidas,noon,400.0,240.0,160.0,Men,Sesame/Clay,Polyester
Blast 3 Shorts Forest Night,PUMA,noon,180.0,72.0,108.0,Women,Forest Night,NA
Must Haves Badge Of Sport Logo Print Tshirt Beige,adidas,noon,115.0,86.0,29.0,Men,Beige,NA
Tiro 19 Sweatpants Black,adidas,Namshi,190.0,133.0,57.0,Men,Black,Polyester
Kids JUVE Home Jersey White,adidas,noon,395.0,294.0,101.0,Boys,White,Polyester
Cushion Crew Socks 6 Pk Black/White,Nike,noon,109.0,92.0,17.0,Unisex,Black/White,Cotton Blend
Tide Chaser Board Shorts Capri,UNDER ARMOUR,noon,209.0,104.0,105.0,Men,Capri,Polyester Blend
Kids FC Bayern Home Jersey Fcb True Red/Strong Red/White,adidas,noon,305.0,167.0,138.0,Boys,Fcb True Red/Strong Red/White,NA
En Pointe Training Leggings Puma Black,PUMA,noon,350.0,140.0,210.0,Women,Puma Black,Nylon Blend
Essentials Linear Round Neck Tank Black,adidas,noon,99.0,64.0,35.0,Women,Black,Cotton
Floral Printed Elevate Shorts Rust Pink/Ashen Slate,Nike,noon,203.0,131.0,72.0,Women,Rust Pink/Ashen Slate,Polyester
Arrow Athletic Cropped T-Shirt Prints,Reebok,Namshi,185.0,74.0,111.0,Women,Prints,Combination
Print Box Tshirt Black,VANS,noon,109.0,70.0,39.0,Men,Black,Cotton
Marvel Black Panther Tshirt Grey,adidas,Namshi,115.0,115.0,0.0,Men,Grey,Cotton
Jordan Jumpman Shorts Black,Nike,Namshi,229.0,229.0,0.0,Men,Black,Polyester
D2M 3 Stripe T-Shirt White,adidas,Namshi,135.0,135.0,0.0,Men,White,Fabric
Badge Of Sport T-Shirt Blue,adidas,Namshi,115.0,115.0,0.0,Women,Blue,Combination
Printed Shorts Royal Blue,UNDER ARMOUR,noon,214.0,128.0,86.0,Men,Royal Blue,Polyester
Always On Graphic Leggings Iron Gate/Puma Black,PUMA,noon,265.0,106.0,159.0,Women,Iron Gate/Puma Black,Combination
Classic Vector T-Shirt White,Reebok,noon,205.0,196.0,9.0,Boys,White,NA
Short Sleeve Mh Photo T-Shirt White,adidas,SIVVI,127.6,89.85,37.75,Men,White,Combination
Pure Cap Sleeve T-Shirt Guava Ice,Nike,noon,203.0,121.0,82.0,Women,Guava Ice,NA
D2M Colour Block 3/4 Tights Black,adidas,Namshi,165.0,165.0,0.0,Women,Black,Polyester
Logo Printed Tracksuit Black,adidas,Namshi,349.0,349.0,0.0,Women,Black,Polyester
Elasticated Waist Shorts Black,Nike,noon,145.0,79.0,66.0,Women,Black,Polyester
Arsenal FC Home Jersey Red,adidas,noon,409.0,409.0,0.0,Men,Red,Polyester Blend
Must Haves Pocket Detail Tshirt Raw Khaki,adidas,noon,115.0,74.0,41.0,Men,Raw Khaki,Cotton
Indy Floral Longline Sports Bra Black/White/Gunsmoke,Nike,noon,195.0,136.0,59.0,Women,Black/White/Gunsmoke,Polyester Blend
Graphic Jersey Tshirt Black,adidas,noon,119.0,77.0,42.0,Men,Black,Cotton
Meet You There Low Impact Bra Cobalt,Reebok,noon,130.0,91.0,39.0,Women,Cobalt,Polyamide
Flex Logo Waist Shorts Black/Htr/White,Nike,noon,129.0,103.0,26.0,Women,Black/Htr/White,Polyester
Activchill Graphic T-Shirt Cranberry Red,Reebok,noon,185.0,167.0,18.0,Men,Cranberry Red,NA
Adidas Athletics Pack T-Shirt Black,adidas,SIVVI,203.2,141.9,61.3,Men,Black,Combination
Must Have Badge Of Sport Sweatpants Black,adidas,Namshi,209.0,209.0,0.0,Men,Black,Cotton
Superstar Sweatpants Black,adidas Originals,Namshi,275.0,193.0,82.0,Women,Black,Polyester
Essential Logo Sweatpants Navy,PUMA,Namshi,185.0,185.0,0.0,Men,Navy,Combination
SST Track Jacket Black,adidas Originals,Namshi,325.0,325.0,0.0,Women,Black,Combination
Nsw Basic Tracksuit Black/White,Nike,noon,299.0,239.0,60.0,Men,Black/White,NA
Ac F Dis Pants Collegiate Navy,Reebok,noon,284.0,170.0,114.0,Men,Collegiate Navy,Cotton
Sportstyle Wordmark Logo Shorts Black/White,UNDER ARMOUR,noon,179.0,125.0,54.0,Men,Black/White,Cotton Blend
Graphic T-Shirt Black,Reebok,noon,185.0,167.0,18.0,Men,Black,NA
NSW AOP T-Shirt Multicolour,Nike,Namshi,169.0,110.0,59.0,Women,Multicolour,Cotton
Design 2 Move Climalite Logo Print Tshirt Tech Ink,adidas,noon,115.0,86.0,29.0,Men,Tech Ink,NA
Classic Graphic T-shirt White,Reebok,noon,130.0,117.0,13.0,Boys,White,Cotton
Manchester Away City Jersey T-shirt Black/Green/Blue,Nike,noon,405.0,243.0,162.0,Men,Black/Green/Blue,NA
